Series_Title,Released_Year,Runtime,Genre,Rating,Overview,Director,Star1,Star2,Star3,Star4
Harry Potter and the Deathly Hallows: Part 1,2010,146,"Adventure, Family, Fantasy",7.7,"As Harry, Ron, and Hermione race against time and evil to destroy the Horcruxes, they uncover the existence of the three most powerful objects in the wizarding world: the Deathly Hallows.",David Yates,Daniel Radcliffe,Emma Watson,Rupert Grint,Bill Nighy
Harry Potter and the Deathly Hallows: Part 2,2011,130,"Adventure, Drama, Fantasy",8.1,"Harry, Ron, and Hermione search for Voldemort's remaining Horcruxes in their effort to destroy the Dark Lord as the final battle rages on at Hogwarts.",David Yates,Daniel Radcliffe,Emma Watson,Rupert Grint,Michael Gambon
Harry Potter and the Goblet of Fire,2005,157,"Adventure, Family, Fantasy",7.7,"Harry Potter finds himself competing in a hazardous tournament between rival schools of magic, but he is distracted by recurring nightmares.",Mike Newell,Daniel Radcliffe,Emma Watson,Rupert Grint,Eric Sykes
Harry Potter and the Half-Blood Prince,2009,153,"Action, Adventure, Family",7.6,"As Harry Potter begins his sixth year at Hogwarts, he discovers an old book marked as ""the property of the Half-Blood Prince"" and begins to learn more about Lord Voldemort's dark past.",David Yates,Daniel Radcliffe,Emma Watson,Rupert Grint,Michael Gambon
Harry Potter and the Prisoner of Azkaban,2004,142,"Adventure, Family, Fantasy",7.9,"Harry Potter, Ron and Hermione return to Hogwarts School of Witchcraft and Wizardry for their third year of study, where they delve into the mystery surrounding an escaped prisoner who poses a dangerous threat to the young wizard.",Alfonso Cuarón,Daniel Radcliffe,Emma Watson,Rupert Grint,Richard Griffiths
Harry Potter and the Sorcerer's Stone,2001,152,"Adventure, Family, Fantasy",7.6,"An orphaned boy enrolls in a school of wizardry, where he learns the truth about himself, his family and the terrible evil that haunts the magical world.",Chris Columbus,Daniel Radcliffe,Rupert Grint,Richard Harris,Maggie Smith
Hauru no ugoku shiro,2004,119,"Animation, Adventure, Family",8.2,"When an unconfident young woman is cursed with an old body by a spiteful witch, her only chance of breaking the spell lies with a self-indulgent yet insecure young wizard and his companions in his legged, walking castle.",Hayao Miyazaki,Chieko Baishô,Takuya Kimura,Tatsuya Gashûin,Akihiro Miwa
Hedwig and the Angry Inch,2001,95,"Comedy, Drama, Music",7.7,A gender-queer punk-rock singer from East Berlin tours the U.S. with her band as she tells her life story and follows the former lover/band-mate who stole her songs.,John Cameron Mitchell,John Cameron Mitchell,Miriam Shor,Stephen Trask,Theodore Liscinski
Hell or High Water,2016,102,"Action, Crime, Drama",7.6,A divorced father and his ex-con older brother resort to a desperate scheme in order to save their family's ranch in West Texas.,David Mackenzie,Chris Pine,Ben Foster,Jeff Bridges,Gil Birmingham
Her,2013,126,"Drama, Romance, Sci-Fi",8,"In a near future, a lonely writer develops an unlikely relationship with an operating system designed to meet his every need.",Spike Jonze,Joaquin Phoenix,Amy Adams,Scarlett Johansson,Rooney Mara
Hera Pheri,2000,156,"Action, Comedy, Crime",8.2,"Three unemployed men look for answers to all their money problems - but when their opportunity arrives, will they know what to do with it?",Priyadarshan,Akshay Kumar,Sunil Shetty,Paresh Rawal,Tabu
Hidden Figures,2016,127,"Biography, Drama, History",7.8,The story of a team of female African-American mathematicians who served a vital role in NASA during the early years of the U.S. space program.,Theodore Melfi,Taraji P. Henson,Octavia Spencer,Janelle Monáe,Kevin Costner
Hot Fuzz,2007,121,"Action, Comedy, Mystery",7.8,A skilled London police officer is transferred to a small town with a dark secret.,Edgar Wright,Simon Pegg,Nick Frost,Martin Freeman,Bill Nighy
Hotel Rwanda,2004,121,"Biography, Drama, History",8.1,"Paul Rusesabagina, a hotel manager, houses over a thousand Tutsi refugees during their struggle against the Hutu militia in Rwanda, Africa.",Terry George,Don Cheadle,Sophie Okonedo,Joaquin Phoenix,Xolani Mali
How to Train Your Dragon,2010,98,"Animation, Action, Adventure",8.1,"A hapless young Viking who aspires to hunt dragons becomes the unlikely friend of a young dragon himself, and learns there may be more to the creatures than he assumed.",Dean DeBlois,Chris Sanders,Jay Baruchel,Gerard Butler,Christopher Mintz-Plasse
How to Train Your Dragon 2,2014,102,"Animation, Action, Adventure",7.8,"When Hiccup and Toothless discover an ice cave that is home to hundreds of new wild dragons and the mysterious Dragon Rider, the two friends find themselves at the center of a battle to protect the peace.",Dean DeBlois,Jay Baruchel,Cate Blanchett,Gerard Butler,Craig Ferguson
Hunt for the Wilderpeople,2016,101,"Adventure, Comedy, Drama",7.9,A national manhunt is ordered for a rebellious kid and his foster uncle who go missing in the wild New Zealand bush.,Taika Waititi,Sam Neill,Julian Dennison,Rima Te Wiata,Rachel House
Huo Yuan Jia,2006,104,"Action, Biography, Drama",7.6,"A biography of Chinese Martial Arts Master Huo Yuanjia, who is the founder and spiritual guru of the Jin Wu Sports Federation.",Ronny Yu,Jet Li,Li Sun,Yong Dong,Yun Qu
I Am Sam,2001,132,Drama,7.7,A mentally handicapped man fights for custody of his 7-year-old daughter and in the process teaches his cold-hearted lawyer the value of love and family.,Jessie Nelson,Sean Penn,Michelle Pfeiffer,Dakota Fanning,Dianne Wiest
"I, Daniel Blake",2016,100,Drama,7.9,"After having suffered a heart-attack, a 59-year-old carpenter must fight the bureaucratic forces of the system in order to receive Employment and Support Allowance.",Ken Loach,Laura Obiols,Dave Johns,Hayley Squires,Sharon Percy
In America,2002,105,Drama,7.7,A family of Irish immigrants adjust to life on the mean streets of Hell's Kitchen while also grieving the death of a child.,Jim Sheridan,Paddy Considine,Samantha Morton,Djimon Hounsou,Sarah Bolger
In Bruges,2008,107,"Comedy, Crime, Drama",7.9,"Guilt-stricken after a job gone wrong, hitman Ray and his partner await orders from their ruthless boss in Bruges, Belgium, the last place in the world Ray wants to be.",Martin McDonagh,Colin Farrell,Brendan Gleeson,Ciarán Hinds,Elizabeth Berrington
Incendies,2010,131,"Drama, Mystery, War",8.3,Twins journey to the Middle East to discover their family history and fulfill their mother's last wishes.,Denis Villeneuve,Lubna Azabal,Mélissa Désormeaux-Poulin,Maxim Gaudette,Mustafa Kamel
Inception,2010,148,"Action, Adventure, Sci-Fi",8.8,A thief who steals corporate secrets through the use of dream-sharing technology is given the inverse task of planting an idea into the mind of a C.E.O.,Christopher Nolan,Leonardo DiCaprio,Joseph Gordon-Levitt,Elliot Page,Ken Watanabe
Incredibles 2,2018,118,"Animation, Action, Adventure",7.6,The Incredibles family takes on a new mission which involves a change in family roles: Bob Parr (Mr. Incredible) must manage the house while his wife Helen (Elastigirl) goes out to save the world.,Brad Bird,Craig T. Nelson,Holly Hunter,Sarah Vowell,Huck Milner
Inglourious Basterds,2009,153,"Adventure, Drama, War",8.3,"In Nazi-occupied France during World War II, a plan to assassinate Nazi leaders by a group of Jewish U.S. soldiers coincides with a theatre owner's vengeful plans for the same.",Quentin Tarantino,Brad Pitt,Diane Kruger,Eli Roth,Mélanie Laurent
Inside Man,2006,129,"Crime, Drama, Mystery",7.6,"A police detective, a bank robber, and a high-power broker enter high-stakes negotiations after the criminal's brilliant heist spirals into a hostage situation.",Spike Lee,Denzel Washington,Clive Owen,Jodie Foster,Christopher Plummer
Inside Out,2015,95,"Animation, Adventure, Comedy",8.1,"After young Riley is uprooted from her Midwest life and moved to San Francisco, her emotions - Joy, Fear, Anger, Disgust and Sadness - conflict on how best to navigate a new city, house, and school.",Pete Docter,Ronnie Del Carmen,Amy Poehler,Bill Hader,Lewis Black
Interstate 60: Episodes of the Road,2002,116,"Adventure, Comedy, Drama",7.7,"Neal Oliver, a very confused young man and an artist, takes a journey of a lifetime on a highway I60 that doesn't exist on any of the maps, going to the places he never even heard of, searching for an answer and his dreamgirl.",Bob Gale,James Marsden,Gary Oldman,Kurt Russell,Matthew Edison
Interstellar,2014,169,"Adventure, Drama, Sci-Fi",8.6,A team of explorers travel through a wormhole in space in an attempt to ensure humanity's survival.,Christopher Nolan,Matthew McConaughey,Anne Hathaway,Jessica Chastain,Mackenzie Foy
Into the Wild,2007,148,"Adventure, Biography, Drama",8.1,"After graduating from Emory University, top student and athlete Christopher McCandless abandons his possessions, gives his entire $24,000 savings account to charity and hitchhikes to Alaska to live in the wilderness. Along the way, Christopher encounters a series of characters that shape his life.",Sean Penn,Emile Hirsch,Vince Vaughn,Catherine Keener,Marcia Gay Harden
Iron Man,2008,126,"Action, Adventure, Sci-Fi",7.9,"After being held captive in an Afghan cave, billionaire engineer Tony Stark creates a unique weaponized suit of armor to fight evil.",Jon Favreau,Robert Downey Jr.,Gwyneth Paltrow,Terrence Howard,Jeff Bridges
Isle of Dogs,2018,101,"Animation, Adventure, Comedy",7.9,"Set in Japan, Isle of Dogs follows a boy's odyssey in search of his lost dog.",Wes Anderson,Bryan Cranston,Koyu Rankin,Edward Norton,Bob Balaban
Jab We Met,2007,138,"Comedy, Drama, Romance",7.9,A depressed wealthy businessman finds his life changing after he meets a spunky and care-free young woman.,Imtiaz Ali,Shahid Kapoor,Kareena Kapoor,Tarun Arora,Dara Singh
Jagten,2012,115,Drama,8.3,"A teacher lives a lonely life, all the while struggling over his son's custody. His life slowly gets better as he finds love and receives good news from his son, but his new luck is about to be brutally shattered by an innocent little lie.",Thomas Vinterberg,Mads Mikkelsen,Thomas Bo Larsen,Annika Wedderkopp,Lasse Fogelstrøm
Jeux d'enfants,2003,93,"Comedy, Drama, Romance",7.6,"As adults, best friends Julien and Sophie continue the odd game they started as children -- a fearless competition to outdo one another with daring and outrageous stunts. While they often act out to relieve one another's pain, their game might be a way to avoid the fact that they are truly meant for one another.",Yann Samuell,Guillaume Canet,Marion Cotillard,Thibault Verhaeghe,Joséphine Lebas-Joly
Jodaeiye Nader az Simin,2011,123,Drama,8.3,A married couple are faced with a difficult decision - to improve the life of their child by moving to another country or to stay in Iran and look after a deteriorating parent who has Alzheimer's disease.,Asghar Farhadi,Payman Maadi,Leila Hatami,Sareh Bayat,Shahab Hosseini
Jojo Rabbit,2019,108,"Comedy, Drama, War",7.9,A young boy in Hitler's army finds out his mother is hiding a Jewish girl in their home.,Taika Waititi,Roman Griffin Davis,Thomasin McKenzie,Scarlett Johansson,Taika Waititi
Joker,2019,122,"Crime, Drama, Thriller",8.5,"In Gotham City, mentally troubled comedian Arthur Fleck is disregarded and mistreated by society. He then embarks on a downward spiral of revolution and bloody crime. This path brings him face-to-face with his alter-ego: the Joker.",Todd Phillips,Joaquin Phoenix,Robert De Niro,Zazie Beetz,Frances Conroy
Joyeux Noël,2005,116,"Drama, History, Music",7.7,"In December 1914, an unofficial Christmas truce on the Western Front allows soldiers from opposing sides of the First World War to gain insight into each other's way of life.",Christian Carion,Diane Kruger,Benno Fürmann,Guillaume Canet,Natalie Dessay
Just Mercy,2019,137,"Biography, Crime, Drama",7.6,World-renowned civil rights defense attorney Bryan Stevenson works to free a wrongly condemned death row prisoner.,Destin Daniel Cretton,Michael B. Jordan,Jamie Foxx,Brie Larson,Charlie Pye Jr.
K.G.F: Chapter 1,2018,156,"Action, Drama",8.2,"In the 1970s, a fierce rebel rises against brutal oppression and becomes the symbol of hope to legions of downtrodden people.",Prashanth Neel,Yash,Srinidhi Shetty,Ramachandra Raju,Archana Jois
Kaguyahime no monogatari,2013,137,"Animation, Adventure, Drama",8,"Found inside a shining stalk of bamboo by an old bamboo cutter and his wife, a tiny girl grows rapidly into an exquisite young lady. The mysterious young princess enthralls all who encounter her, but ultimately she must confront her fate, the punishment for her crime.",Isao Takahata,Chloë Grace Moretz,James Caan,Mary Steenburgen,James Marsden
Kahaani,2012,122,"Mystery, Thriller",8.1,"A pregnant woman's search for her missing husband takes her from London to Kolkata, but everyone she questions denies having ever met him.",Sujoy Ghosh,Vidya Balan,Parambrata Chattopadhyay,Indraneil Sengupta,Nawazuddin Siddiqui
Kai po che!,2013,130,"Drama, Sport",7.7,Three friends growing up in India at the turn of the millennium set out to open a training academy to produce the country's next cricket stars.,Abhishek Kapoor,Amit Sadh,Sushant Singh Rajput,Rajkummar Rao,Amrita Puri
Kal Ho Naa Ho,2003,186,"Comedy, Drama, Musical",8,"Naina, an introverted, perpetually depressed girl's life changes when she meets Aman. But Aman has a secret of his own which changes their lives forever. Embroiled in all this is Rohit, Naina's best friend who conceals his love for her.",Nikkhil Advani,Preity Zinta,Shah Rukh Khan,Saif Ali Khan,Jaya Bachchan
Kari-gurashi no Arietti,2010,94,"Animation, Adventure, Family",7.6,"The Clock family are four-inch-tall people who live anonymously in another family's residence, borrowing simple items to make their home. Life changes for the Clocks when their teenage daughter, Arrietty, is discovered.",Hiromasa Yonebayashi,Amy Poehler,Mirai Shida,Ryûnosuke Kamiki,Tatsuya Fujiwara
Kaze tachinu,2013,126,"Animation, Biography, Drama",7.8,"A look at the life of Jiro Horikoshi, the man who designed Japanese fighter planes during World War II.",Hayao Miyazaki,Hideaki Anno,Hidetoshi Nishijima,Miori Takimoto,Masahiko Nishimura
Kick-Ass,2010,117,"Action, Comedy, Crime",7.6,"Dave Lizewski is an unnoticed high school student and comic book fan who one day decides to become a superhero, even though he has no powers, training or meaningful reason to do so.",Matthew Vaughn,Aaron Taylor-Johnson,Nicolas Cage,Chloë Grace Moretz,Garrett M. Brown
Kill Bill: Vol. 1,2003,111,"Action, Crime, Drama",8.1,"After awakening from a four-year coma, a former assassin wreaks vengeance on the team of assassins who betrayed her.",Quentin Tarantino,Uma Thurman,David Carradine,Daryl Hannah,Michael Madsen
Kill Bill: Vol. 2,2004,137,"Action, Crime, Thriller",8,"The Bride continues her quest of vengeance against her former boss and lover Bill, the reclusive bouncer Budd, and the treacherous, one-eyed Elle.",Quentin Tarantino,Uma Thurman,David Carradine,Michael Madsen,Daryl Hannah
Kimi no na wa.,2016,106,"Animation, Drama, Fantasy",8.4,"Two strangers find themselves linked in a bizarre way. When a connection forms, will distance be the only thing to keep them apart?",Makoto Shinkai,Ryûnosuke Kamiki,Mone Kamishiraishi,Ryô Narita,Aoi Yûki
Kingsman: The Secret Service,2014,129,"Action, Adventure, Comedy",7.7,"A spy organisation recruits a promising street kid into the agency's training program, while a global threat emerges from a twisted tech genius.",Matthew Vaughn,Colin Firth,Taron Egerton,Samuel L. Jackson,Michael Caine
Kis Uykusu,2014,196,Drama,8.1,A hotel owner and landlord in a remote Turkish village deals with conflicts within his family and a tenant behind on his rent.,Nuri Bilge Ceylan,Haluk Bilginer,Melisa Sözen,Demet Akbag,Ayberk Pekcan
Klaus,2019,96,"Animation, Adventure, Comedy",8.2,"A simple act of kindness always sparks another, even in a frozen, faraway place. When Smeerensburg's new postman, Jesper, befriends toymaker Klaus, their gifts melt an age-old feud and deliver a sleigh full of holiday traditions.",Sergio Pablos,Carlos Martínez López,Jason Schwartzman,J.K. Simmons,Rashida Jones
Knives Out,2019,130,"Comedy, Crime, Drama",7.9,"A detective investigates the death of a patriarch of an eccentric, combative family.",Rian Johnson,Daniel Craig,Chris Evans,Ana de Armas,Jamie Lee Curtis
Knockin' on Heaven's Door,1997,87,"Action, Crime, Comedy",8,"Two terminally ill patients escape from a hospital, steal a car and rush towards the sea.",Thomas Jahn,Til Schweiger,Jan Josef Liefers,Thierry van Werveke,Moritz Bleibtreu
Koe no katachi,2016,130,"Animation, Drama, Family",8.1,"A young man is ostracized by his classmates after he bullies a deaf girl to the point where she moves away. Years later, he sets off on a path for redemption.",Naoko Yamada,Miyu Irino,Saori Hayami,Aoi Yûki,Kenshô Ono
Kokuhaku,2010,106,"Drama, Thriller",7.8,A psychological thriller of a grieving mother turned cold-blooded avenger with a twisty master plan to pay back those who were responsible for her daughter's death.,Tetsuya Nakashima,Takako Matsu,Yoshino Kimura,Masaki Okada,Yukito Nishii
Kubo and the Two Strings,2016,101,"Animation, Action, Adventure",7.8,A young boy named Kubo must locate a magical suit of armour worn by his late father in order to defeat a vengeful spirit from the past.,Travis Knight,Charlize Theron,Art Parkinson,Matthew McConaughey,Ralph Fiennes
Kung fu,2004,99,"Action, Comedy, Fantasy",7.7,"In Shanghai, China in the 1940s, a wannabe gangster aspires to join the notorious ""Axe Gang"" while residents of a housing complex exhibit extraordinary powers in defending their turf.",Stephen Chow,Stephen Chow,Wah Yuen,Qiu Yuen,Siu-Lung Leung
L.A. Confidential,1997,138,"Crime, Drama, Mystery",8.2,"As corruption grows in 1950s Los Angeles, three policemen - one strait-laced, one brutal, and one sleazy - investigate a series of murders with their own brand of justice.",Curtis Hanson,Kevin Spacey,Russell Crowe,Guy Pearce,Kim Basinger
La grande bellezza,2013,141,Drama,7.8,"Jep Gambardella has seduced his way through the lavish nightlife of Rome for decades, but after his 65th birthday and a shock from the past, Jep looks past the nightclubs and parties to find a timeless landscape of absurd, exquisite beauty.",Paolo Sorrentino,Toni Servillo,Carlo Verdone,Sabrina Ferilli,Carlo Buccirosso
La La Land,2016,128,"Comedy, Drama, Music",8,"While navigating their careers in Los Angeles, a pianist and an actress fall in love while attempting to reconcile their aspirations for the future.",Damien Chazelle,Ryan Gosling,Emma Stone,Rosemarie DeWitt,J.K. Simmons
La leggenda del pianista sull'oceano,1998,169,"Drama, Music, Romance",8.1,"A baby boy, discovered in 1900 on an ocean liner, grows into a musical prodigy, never setting foot on land.",Giuseppe Tornatore,Tim Roth,Pruitt Taylor Vince,Mélanie Thierry,Bill Nunn
La migliore offerta,2013,131,"Crime, Drama, Mystery",7.8,A lonely art expert working for a mysterious and reclusive heiress finds not only her art worth examining.,Giuseppe Tornatore,Geoffrey Rush,Jim Sturgess,Sylvia Hoeks,Donald Sutherland
La piel que habito,2011,120,"Drama, Horror, Thriller",7.6,"A brilliant plastic surgeon, haunted by past tragedies, creates a type of synthetic skin that withstands any kind of damage. His guinea pig: a mysterious and volatile woman who holds the key to his obsession.",Pedro Almodóvar,Antonio Banderas,Elena Anaya,Jan Cornet,Marisa Paredes
La vie d'Adèle,2013,180,"Drama, Romance",7.7,"Adèle's life is changed when she meets Emma, a young woman with blue hair, who will allow her to discover desire and to assert herself as a woman and as an adult. In front of others, Adèle grows, seeks herself, loses herself, and ultimately finds herself through love and loss.",Abdellatif Kechiche,Léa Seydoux,Adèle Exarchopoulos,Salim Kechiouche,Aurélien Recoing
La Vie En Rose,2007,140,"Biography, Drama, Music",7.6,"Biopic of the iconic French singer Édith Piaf. Raised by her grandmother in a brothel, she was discovered while singing on a street corner at the age of 19. Despite her success, Piaf's life was filled with tragedy.",Olivier Dahan,Marion Cotillard,Sylvie Testud,Pascal Greggory,Emmanuelle Seigner
La vita è bella,1997,116,"Comedy, Drama, Romance",8.6,"When an open-minded Jewish librarian and his son become victims of the Holocaust, he uses a perfect mixture of will, humor, and imagination to protect his son from the dangers around their camp.",Roberto Benigni,Roberto Benigni,Nicoletta Braschi,Giorgio Cantarini,Giustino Durano
Låt den rätte komma in,2008,114,"Crime, Drama, Fantasy",7.9,"Oskar, an overlooked and bullied boy, finds love and revenge through Eli, a beautiful but peculiar girl.",Tomas Alfredson,Kåre Hedebrant,Lina Leandersson,Per Ragnar,Henrik Dahl
Lagaan: Once Upon a Time in India,2001,224,"Adventure, Drama, Musical",8.1,The people of a small village in Victorian India stake their future on a game of cricket against their ruthless British rulers.,Ashutosh Gowariker,Aamir Khan,Raghuvir Yadav,Gracy Singh,Rachel Shelley
Lage Raho Munna Bhai,2006,144,"Comedy, Drama, Romance",8.1,Munna Bhai embarks on a journey with Mahatma Gandhi in order to fight against a corrupt property dealer.,Rajkumar Hirani,Sanjay Dutt,Arshad Warsi,Vidya Balan,Boman Irani
Le dîner de cons,1998,80,Comedy,7.7,"A few friends have a weekly fools' dinner, where each brings a fool along. Pierre finds a champion fool for next dinner. Surprise.",Francis Veber,Thierry Lhermitte,Jacques Villeret,Francis Huster,Daniel Prévost
Le passé,2013,130,"Drama, Mystery",7.8,"An Iranian man deserts his French wife and her two children to return to his homeland. Meanwhile, his wife starts up a new relationship, a reality her husband confronts upon his wife's request for a divorce.",Asghar Farhadi,Bérénice Bejo,Tahar Rahim,Ali Mosaffa,Pauline Burlet
Le Petit Prince,2015,108,"Animation, Adventure, Drama",7.7,"A little girl lives in a very grown-up world with her mother, who tries to prepare her for it. Her neighbor, the Aviator, introduces the girl to an extraordinary world where anything is possible, the world of the Little Prince.",Mark Osborne,Jeff Bridges,Mackenzie Foy,Rachel McAdams,Marion Cotillard
Le scaphandre et le papillon,2007,112,"Biography, Drama",8,The true story of Elle editor Jean-Dominique Bauby who suffers a stroke and has to live with an almost totally paralyzed body; only his left eye isn't paralyzed.,Julian Schnabel,Laura Obiols,Mathieu Amalric,Emmanuelle Seigner,Marie-Josée Croze
Les choristes,2004,97,"Drama, Music",7.9,The new teacher at a severely administered boys' boarding school works to positively affect the students' lives through music.,Christophe Barratier,Gérard Jugnot,François Berléand,Jean-Baptiste Maunier,Kad Merad
Les triplettes de Belleville,2003,80,"Animation, Comedy, Drama",7.8,"When her grandson is kidnapped during the Tour de France, Madame Souza and her beloved pooch Bruno team up with the Belleville Sisters--an aged song-and-dance team from the days of Fred Astaire--to rescue him.",Sylvain Chomet,Michèle Caucheteux,Jean-Claude Donda,Michel Robin,Monica Viegas
Letters from Iwo Jima,2006,141,"Action, Adventure, Drama",7.9,"The story of the battle of Iwo Jima between the United States and Imperial Japan during World War II, as told from the perspective of the Japanese who fought it.",Clint Eastwood,Ken Watanabe,Kazunari Ninomiya,Tsuyoshi Ihara,Ryô Kase
Leviafan,2014,140,"Crime, Drama",7.6,"In a Russian coastal town, Kolya is forced to fight the corrupt mayor when he is told that his house will be demolished. He recruits a lawyer friend to help, but the man's arrival brings further misfortune for Kolya and his family.",Andrey Zvyagintsev,Aleksey Serebryakov,Elena Lyadova,Roman Madyanov,Vladimir Vdovichenkov
Life of Pi,2012,127,"Adventure, Drama, Fantasy",7.9,"A young man who survives a disaster at sea is hurtled into an epic journey of adventure and discovery. While cast away, he forms an unexpected connection with another survivor: a fearsome Bengal tiger.",Ang Lee,Suraj Sharma,Irrfan Khan,Adil Hussain,Tabu
Lilja 4-ever,2002,109,"Crime, Drama",7.8,"Sixteen-year-old Lilja and her only friend, the young boy Volodja, live in Russia, fantasizing about a better life. One day, Lilja falls in love with Andrej, who is going to Sweden, and invites Lilja to come along and start a new life.",Lukas Moodysson,Oksana Akinshina,Artyom Bogucharskiy,Pavel Ponomaryov,Lyubov Agapova
Lion,2016,118,"Biography, Drama",8,"A five-year-old Indian boy is adopted by an Australian couple after getting lost hundreds of kilometers from home. 25 years later, he sets out to find his lost family.",Garth Davis,Dev Patel,Nicole Kidman,Rooney Mara,Sunny Pawar
Little Miss Sunshine,2006,101,"Comedy, Drama",7.8,A family determined to get their young daughter into the finals of a beauty pageant take a cross-country trip in their VW bus.,Jonathan Dayton,Valerie Faris,Steve Carell,Toni Collette,Greg Kinnear
Little Women,2019,135,"Drama, Romance",7.8,"Jo March reflects back and forth on her life, telling the beloved story of the March sisters - four young women, each determined to live life on her own terms.",Greta Gerwig,Saoirse Ronan,Emma Watson,Florence Pugh,Eliza Scanlen
"Lock, Stock and Two Smoking Barrels",1998,107,"Action, Comedy, Crime",8.2,"A botched card game in London triggers four friends, thugs, weed-growers, hard gangsters, loan sharks and debt collectors to collide with each other in a series of unexpected events, all for the sake of weed, cash and two antique shotguns.",Guy Ritchie,Jason Flemyng,Dexter Fletcher,Nick Moran,Jason Statham
