Series_Title,Released_Year,Runtime,Genre,Rating,Overview,Director,Star1,Star2,Star3,Star4
300,2006,117,"Action, Drama",7.6,King Leonidas of Sparta and a force of 300 men fight the Persians at Thermopylae in 480 B.C.,Zack Snyder,Gerard Butler,Lena Headey,David Wenham,Dominic West
1917,2019,119,"Drama, Thriller, War",8.3,"April 6th, 1917. As a regiment assembles to wage war deep in enemy territory, two soldiers are assigned to race against time and deliver a message that will stop 1,600 men from walking straight into a deadly trap.",Sam Mendes,Dean-Charles Chapman,George MacKay,Daniel Mays,Colin Firth
(500) Days of Summer,2009,95,"Comedy, Drama, Romance",7.7,"An offbeat romantic comedy about a woman who doesn't believe true love exists, and the young man who falls for her.",Marc Webb,Zooey Deschanel,Joseph Gordon-Levitt,Geoffrey Arend,Chloë Grace Moretz
12 Years a Slave,2013,134,"Biography, Drama, History",8.1,"In the antebellum United States, Solomon Northup, a free black man from upstate New York, is abducted and sold into slavery.",Steve McQueen,Chiwetel Ejiofor,Michael Kenneth Williams,Michael Fassbender,Brad Pitt
21 Grams,2003,124,"Crime, Drama, Thriller",7.6,"A freak accident brings together a critically ill mathematician, a grieving mother, and a born-again ex-con.",Alejandro G. Iñárritu,Sean Penn,Benicio Del Toro,Naomi Watts,Danny Huston
25th Hour,2002,135,Drama,7.6,"Cornered by the DEA, convicted New York drug dealer Montgomery Brogan reevaluates his life in the 24 remaining hours before facing a seven-year jail term.",Spike Lee,Edward Norton,Barry Pepper,Philip Seymour Hoffman,Rosario Dawson
28 Days Later...,2002,113,"Drama, Horror, Sci-Fi",7.6,"Four weeks after a mysterious, incurable virus spreads throughout the UK, a handful of survivors try to find sanctuary.",Danny Boyle,Cillian Murphy,Naomie Harris,Christopher Eccleston,Alex Palmer
3 Idiots,2009,170,"Comedy, Drama",8.4,"Two friends are searching for their long lost companion. They revisit their college days and recall the memories of their friend who inspired them to think differently, even as the rest of the world called them ""idiots"".",Rajkumar Hirani,Aamir Khan,Madhavan,Mona Singh,Sharman Joshi
3:10 to Yuma,2007,122,"Action, Crime, Drama",7.7,A small-time rancher agrees to hold a captured outlaw who's awaiting a train to go to court in Yuma. A battle of wills ensues as the outlaw tries to psych out the rancher.,James Mangold,Russell Crowe,Christian Bale,Ben Foster,Logan Lerman
"4 luni, 3 saptamâni si 2 zile",2007,113,Drama,7.9,A woman assists her friend in arranging an illegal abortion in 1980s Romania.,Cristian Mungiu,Anamaria Marinca,Laura Vasiliu,Vlad Ivanov,Alexandru Potocean
50/50,2011,100,"Comedy, Drama, Romance",7.6,"Inspired by a true story, a comedy centered on a 27-year-old guy who learns of his cancer diagnosis and his subsequent struggle to beat the disease.",Jonathan Levine,Joseph Gordon-Levitt,Seth Rogen,Anna Kendrick,Bryce Dallas Howard
A Beautiful Mind,2001,135,"Biography, Drama",8.2,"After John Nash, a brilliant but asocial mathematician, accepts secret work in cryptography, his life takes a turn for the nightmarish.",Ron Howard,Russell Crowe,Ed Harris,Jennifer Connelly,Christopher Plummer
A Star Is Born,2018,136,"Drama, Music, Romance",7.6,A musician helps a young singer find fame as age and alcoholism send his own career into a downward spiral.,Bradley Cooper,Lady Gaga,Bradley Cooper,Sam Elliott,Greg Grunberg
A Wednesday,2008,104,"Action, Crime, Drama",8.1,A retiring police officer reminisces about the most astounding day of his career. About a case that was never filed but continues to haunt him in his memories - the case of a man and a Wednesday.,Neeraj Pandey,Anupam Kher,Naseeruddin Shah,Jimmy Sheirgill,Aamir Bashir
Ôkami kodomo no Ame to Yuki,2012,117,"Animation, Drama, Fantasy",8.1,"After her werewolf lover unexpectedly dies in an accident while hunting for food for their children, a young woman must find ways to raise the werewolf son and daughter that she had with him while keeping their trait hidden from society.",Mamoru Hosoda,Aoi Miyazaki,Takao Osawa,Haru Kuroki,Yukito Nishii
About Time,2013,123,"Comedy, Drama, Fantasy",7.8,"At the age of 21, Tim discovers he can travel in time and change what happens and has happened in his own life. His decision to make his world a better place by getting a girlfriend turns out not to be as easy as you might think.",Richard Curtis,Domhnall Gleeson,Rachel McAdams,Bill Nighy,Lydia Wilson
Abre los ojos,1997,119,"Drama, Mystery, Sci-Fi",7.7,"A very handsome man finds the love of his life, but he suffers an accident and needs to have his face rebuilt by surgery after it is severely disfigured.",Alejandro Amenábar,Eduardo Noriega,Penélope Cruz,Chete Lera,Fele Martínez
Adams æbler,2005,94,"Comedy, Crime, Drama",7.8,A neo-nazi sentenced to community service at a church clashes with the blindly devotional priest.,Anders Thomas Jensen,Ulrich Thomsen,Mads Mikkelsen,Nicolas Bro,Paprika Steen
Adaptation.,2002,115,"Comedy, Drama",7.7,A lovelorn screenwriter becomes desperate as he tries and fails to adapt 'The Orchid Thief' by Susan Orlean for the screen.,Spike Jonze,Nicolas Cage,Meryl Streep,Chris Cooper,Tilda Swinton
Ah-ga-ssi,2016,145,"Drama, Romance, Thriller",8.1,"A woman is hired as a handmaiden to a Japanese heiress, but secretly she is involved in a plot to defraud her.",Chan-wook Park,Kim Min-hee,Jung-woo Ha,Cho Jin-woong,Moon So-Ri
Airlift,2016,130,"Drama, History",8,"When Iraq invades Kuwait in August 1990, a callous Indian businessman becomes the spokesperson for more than 170,000 stranded countrymen.",Raja Menon,Akshay Kumar,Nimrat Kaur,Kumud Mishra,Prakash Belawadi
Ajeossi,2010,119,"Action, Crime, Drama",7.8,A quiet pawnshop keeper with a violent past takes on a drug-and-organ trafficking ring in hope of saving the child who is his only friend.,Jeong-beom Lee,Won Bin,Sae-ron Kim,Tae-hoon Kim,Hee-won Kim
Almost Famous,2000,122,"Adventure, Comedy, Drama",7.9,A high-school boy is given the chance to write a story for Rolling Stone Magazine about an up-and-coming rock band as he accompanies them on their concert tour.,Cameron Crowe,Billy Crudup,Patrick Fugit,Kate Hudson,Frances McDormand
Amélie,2001,122,"Comedy, Romance",8.3,"Amélie is an innocent and naive girl in Paris with her own sense of justice. She decides to help those around her and, along the way, discovers love.",Jean-Pierre Jeunet,Audrey Tautou,Mathieu Kassovitz,Rufus,Lorella Cravotta
American Beauty,1999,122,Drama,8.3,A sexually frustrated suburban father has a mid-life crisis after becoming infatuated with his daughter's best friend.,Sam Mendes,Kevin Spacey,Annette Bening,Thora Birch,Wes Bentley
American Gangster,2007,157,"Biography, Crime, Drama",7.8,"An outcast New York City cop is charged with bringing down Harlem drug lord Frank Lucas, whose real life inspired this partly biographical film.",Ridley Scott,Denzel Washington,Russell Crowe,Chiwetel Ejiofor,Josh Brolin
American History X,1998,119,Drama,8.5,A former neo-nazi skinhead tries to prevent his younger brother from going down the same wrong path that he did.,Tony Kaye,Edward Norton,Edward Furlong,Beverly D'Angelo,Jennifer Lien
American Psycho,2000,101,"Comedy, Crime, Drama",7.6,"A wealthy New York City investment banking executive, Patrick Bateman, hides his alternate psychopathic ego from his co-workers and friends as he delves deeper into his violent, hedonistic fantasies.",Mary Harron,Christian Bale,Justin Theroux,Josh Lucas,Bill Sage
Amores perros,2000,154,"Drama, Thriller",8.1,"A horrific car accident connects three stories, each involving characters dealing with loss, regret, and life's harsh realities, all in the name of love.",Alejandro G. Iñárritu,Emilio Echevarría,Gael García Bernal,Goya Toledo,Álvaro Guerrero
Amour,2012,127,"Drama, Romance",7.9,"Georges and Anne are an octogenarian couple. They are cultivated, retired music teachers. Their daughter, also a musician, lives in Britain with her family. One day, Anne has a stroke, and the couple's bond of love is severely tested.",Michael Haneke,Jean-Louis Trintignant,Emmanuelle Riva,Isabelle Huppert,Alexandre Tharaud
Andhadhun,2018,139,"Crime, Drama, Music",8.3,"A series of mysterious events change the life of a blind pianist, who must now report a crime that he should technically know nothing of.",Sriram Raghavan,Ayushmann Khurrana,Tabu,Radhika Apte,Anil Dhawan
Ang-ma-reul bo-at-da,2010,144,"Action, Crime, Drama",7.8,A secret agent exacts revenge on a serial killer through a series of captures and releases.,Jee-woon Kim,Lee Byung-Hun,Choi Min-sik,Jeon Gook-Hwan,Ho-jin Chun
Apocalypto,2006,139,"Action, Adventure, Drama",7.8,"As the Mayan kingdom faces its decline, a young man is taken on a perilous journey to a world ruled by fear and oppression.",Mel Gibson,Gerardo Taracena,Raoul Max Trujillo,Dalia Hernández,Rudy Youngblood
Apollo 13,PG,140,"Adventure, Drama, History",7.6,NASA must devise a strategy to return Apollo 13 to Earth safely after the spacecraft undergoes massive internal damage putting the lives of the three astronauts on board in jeopardy.,Ron Howard,Tom Hanks,Bill Paxton,Kevin Bacon,Gary Sinise
Argo,2012,120,"Biography, Drama, Thriller",7.7,"Acting under the cover of a Hollywood producer scouting a location for a science fiction film, a CIA agent launches a dangerous operation to rescue six Americans in Tehran during the U.S. hostage crisis in Iran in 1979.",Ben Affleck,Ben Affleck,Bryan Cranston,John Goodman,Alan Arkin
Arrival,2016,116,"Drama, Sci-Fi",7.9,A linguist works with the military to communicate with alien lifeforms after twelve mysterious spacecrafts appear around the world.,Denis Villeneuve,Amy Adams,Jeremy Renner,Forest Whitaker,Michael Stuhlbarg
As Good as It Gets,1997,139,"Comedy, Drama, Romance",7.7,"A single mother and waitress, a misanthropic author, and a gay artist form an unlikely friendship after the artist is assaulted in a robbery.",James L. Brooks,Jack Nicholson,Helen Hunt,Greg Kinnear,Cuba Gooding Jr.
Atonement,2007,123,"Drama, Mystery, Romance",7.8,Thirteen-year-old fledgling writer Briony Tallis irrevocably changes the course of several lives when she accuses her older sister's lover of a crime he did not commit.,Joe Wright,Keira Knightley,James McAvoy,Brenda Blethyn,Saoirse Ronan
Auf der anderen Seite,2007,122,Drama,7.8,A Turkish man travels to Istanbul to find the daughter of his father's former girlfriend.,Fatih Akin,Baki Davrak,Nurgül Yesilçay,Tuncel Kurtiz,Nursel Köse
Avatar,2009,162,"Action, Adventure, Fantasy",7.8,A paraplegic Marine dispatched to the moon Pandora on a unique mission becomes torn between following his orders and protecting the world he feels is his home.,James Cameron,Sam Worthington,Zoe Saldana,Sigourney Weaver,Michelle Rodriguez
Avengers: Endgame,2019,181,"Action, Adventure, Drama",8.4,"After the devastating events of Avengers: Infinity War (2018), the universe is in ruins. With the help of remaining allies, the Avengers assemble once more in order to reverse Thanos' actions and restore balance to the universe.",Anthony Russo,Joe Russo,Robert Downey Jr.,Chris Evans,Mark Ruffalo
Avengers: Infinity War,2018,149,"Action, Adventure, Sci-Fi",8.4,The Avengers and their allies must be willing to sacrifice all in an attempt to defeat the powerful Thanos before his blitz of devastation and ruin puts an end to the universe.,Anthony Russo,Joe Russo,Robert Downey Jr.,Chris Hemsworth,Mark Ruffalo
Ayla: The Daughter of War,2017,125,"Biography, Drama, History",8.4,"In 1950, amid-st the ravages of the Korean War, Sergeant Süleyman stumbles upon a half-frozen little girl, with no parents and no help in sight. Frantic, scared and on the verge of death, ...                See full summary »",Can Ulkay,Erdem Can,Çetin Tekindor,Ismail Hacioglu,Kyung-jin Lee
Bãhubali: The Beginning,2015,159,"Action, Drama",8,"In ancient India, an adventurous and daring man becomes involved in a decades-old feud between two warring peoples.",S.S. Rajamouli,Prabhas,Rana Daggubati,Ramya Krishnan,Sathyaraj
Baahubali 2: The Conclusion,2017,167,"Action, Drama",8.2,"When Shiva, the son of Bahubali, learns about his heritage, he begins to look for answers. His story is juxtaposed with past events that unfolded in the Mahishmati Kingdom.",S.S. Rajamouli,Prabhas,Rana Daggubati,Anushka Shetty,Tamannaah Bhatia
Babam ve Oglum,2005,112,"Drama, Family",8.3,The family of a left-wing journalist is torn apart after the military coup of Turkey in 1980.,Çagan Irmak,Çetin Tekindor,Fikret Kuskan,Hümeyra,Ege Tanman
Baby,2015,159,"Action, Crime, Thriller",8,"An elite counter-intelligence unit learns of a plot, masterminded by a maniacal madman. With the clock ticking, it's up to them to track the terrorists' international tentacles and prevent them from striking at the heart of India.",Neeraj Pandey,Akshay Kumar,Danny Denzongpa,Rana Daggubati,Taapsee Pannu
Baby Driver,2017,113,"Action, Crime, Drama",7.6,"After being coerced into working for a crime boss, a young getaway driver finds himself taking part in a heist doomed to fail.",Edgar Wright,Ansel Elgort,Jon Bernthal,Jon Hamm,Eiza González
Bacheha-Ye aseman,1997,89,"Drama, Family, Sport",8.3,"After a boy loses his sister's pair of shoes, he goes on a series of adventures in order to find them. When he can't, he tries a new way to ""win"" a new pair.",Majid Majidi,Mohammad Amir Naji,Amir Farrokh Hashemian,Bahare Seddiqi,Nafise Jafar-Mohammadi
Badhaai ho,2018,124,"Comedy, Drama",8,A man is embarrassed when he finds out his mother is pregnant.,Amit Ravindernath Sharma,Ayushmann Khurrana,Neena Gupta,Gajraj Rao,Sanya Malhotra
Bajrangi Bhaijaan,2015,163,"Action, Adventure, Comedy",8,An Indian man with a magnanimous heart takes a young mute Pakistani girl back to her homeland to reunite her with her family.,Kabir Khan,Salman Khan,Harshaali Malhotra,Nawazuddin Siddiqui,Kareena Kapoor
Barfi!,2012,151,"Comedy, Drama, Romance",8.1,Three young people learn that love can neither be defined nor contained by society's definition of normal and abnormal.,Anurag Basu,Ranbir Kapoor,Priyanka Chopra,Ileana D'Cruz,Saurabh Shukla
Batman Begins,2005,140,"Action, Adventure",8.2,"After training with his mentor, Batman begins his fight to free crime-ridden Gotham City from corruption.",Christopher Nolan,Christian Bale,Michael Caine,Ken Watanabe,Liam Neeson
Batoru rowaiaru,2000,114,"Action, Adventure, Drama",7.6,"In the future, the Japanese government captures a class of ninth-grade students and forces them to kill each other under the revolutionary ""Battle Royale"" act.",Kinji Fukasaku,Tatsuya Fujiwara,Aki Maeda,Tarô Yamamoto,Takeshi Kitano
Beasts of No Nation,2015,137,"Drama, War",7.7,"A drama based on the experiences of Agu, a child soldier fighting in the civil war of an unnamed African country.",Cary Joji Fukunaga,Abraham Attah,Emmanuel Affadzi,Ricky Adelayitor,Andrew Adote
Before Midnight,2013,109,"Drama, Romance",7.9,We meet Jesse and Celine nine years on in Greece. Almost two decades have passed since their first meeting on that train bound for Vienna.,Richard Linklater,Ethan Hawke,Julie Delpy,Seamus Davey-Fitzpatrick,Ariane Labed
Before Sunset,2004,80,"Drama, Romance",8.1,"Nine years after Jesse and Celine first met, they encounter each other again on the French leg of Jesse's book tour.",Richard Linklater,Ethan Hawke,Julie Delpy,Vernon Dobtcheff,Louise Lemoine Torrès
Being John Malkovich,1999,113,"Comedy, Drama, Fantasy",7.7,A puppeteer discovers a portal that leads literally into the head of movie star John Malkovich.,Spike Jonze,John Cusack,Cameron Diaz,Catherine Keener,John Malkovich
Bhaag Milkha Bhaag,2013,186,"Biography, Drama, Sport",8.2,The truth behind the ascension of Milkha Singh who was scarred because of the India-Pakistan partition.,Rakeysh Omprakash Mehra,Farhan Akhtar,Sonam Kapoor,Pawan Malhotra,Art Malik
Big Fish,2003,125,"Adventure, Drama, Fantasy",8,A frustrated son tries to determine the fact from fiction in his dying father's life.,Tim Burton,Ewan McGregor,Albert Finney,Billy Crudup,Jessica Lange
Big Hero 6,2014,102,"Animation, Action, Adventure",7.8,"A special bond develops between plus-sized inflatable robot Baymax and prodigy Hiro Hamada, who together team up with a group of friends to form a band of high-tech heroes.",Don Hall,Chris Williams,Ryan Potter,Scott Adsit,Jamie Chung
Billy Elliot,2000,110,"Drama, Music",7.7,A talented young boy becomes torn between his unexpected love of dance and the disintegration of his family.,Stephen Daldry,Jamie Bell,Julie Walters,Jean Heywood,Jamie Draven
Bin-jip,2004,88,"Crime, Drama, Romance",8,A transient young man breaks into empty homes to partake of the vacationing residents' lives for a few days.,Ki-duk Kim,Seung-Yun Lee,Hee Jae,Hyuk-ho Kwon,Jin-mo Joo
Bir Zamanlar Anadolu'da,2011,157,"Crime, Drama",7.9,A group of men set out in search of a dead body in the Anatolian steppes.,Nuri Bilge Ceylan,Muhammet Uzuner,Yilmaz Erdogan,Taner Birsel,Ahmet Mümtaz Taylan
Birdman or (The Unexpected Virtue of Ignorance),2014,119,"Comedy, Drama",7.7,"A washed-up superhero actor attempts to revive his fading career by writing, directing, and starring in a Broadway production.",Alejandro G. Iñárritu,Michael Keaton,Zach Galifianakis,Edward Norton,Andrea Riseborough
Black,2005,122,Drama,8.2,"The cathartic tale of a young woman who can't see, hear or talk and the teacher who brings a ray of light into her dark world.",Sanjay Leela Bhansali,Amitabh Bachchan,Rani Mukerji,Shernaz Patel,Ayesha Kapoor
Black Hawk Down,2001,144,"Drama, History, War",7.7,160 elite U.S. soldiers drop into Somalia to capture two top lieutenants of a renegade warlord and find themselves in a desperate battle with a large force of heavily-armed Somalis.,Ridley Scott,Josh Hartnett,Ewan McGregor,Tom Sizemore,Eric Bana
Black Swan,2010,108,"Drama, Thriller",8,"A committed dancer struggles to maintain her sanity after winning the lead role in a production of Tchaikovsky's ""Swan Lake"".",Darren Aronofsky,Natalie Portman,Mila Kunis,Vincent Cassel,Winona Ryder
Blade Runner 2049,2017,164,"Action, Drama, Mystery",8,"Young Blade Runner K's discovery of a long-buried secret leads him to track down former Blade Runner Rick Deckard, who's been missing for thirty years.",Denis Villeneuve,Harrison Ford,Ryan Gosling,Ana de Armas,Dave Bautista
Blood Diamond,2006,143,"Adventure, Drama, Thriller",8,"A fisherman, a smuggler, and a syndicate of businessmen match wits over the possession of a priceless diamond.",Edward Zwick,Leonardo DiCaprio,Djimon Hounsou,Jennifer Connelly,Kagiso Kuypers
Blow,2001,124,"Biography, Crime, Drama",7.6,"The story of how George Jung, along with the Medellín Cartel headed by Pablo Escobar, established the American cocaine market in the 1970s in the United States.",Ted Demme,Johnny Depp,Penélope Cruz,Franka Potente,Rachel Griffiths
Bohemian Rhapsody,2018,134,"Biography, Drama, Music",8,"The story of the legendary British rock band Queen and lead singer Freddie Mercury, leading up to their famous performance at Live Aid (1985).",Bryan Singer,Rami Malek,Lucy Boynton,Gwilym Lee,Ben Hardy
Boksuneun naui geot,2002,129,"Crime, Drama, Thriller",7.6,"A recently laid off factory worker kidnaps his former boss' friend's daughter, hoping to use the ransom money to pay for his sister's kidney transplant.",Chan-wook Park,Kang-ho Song,Shin Ha-kyun,Bae Doona,Ji-Eun Lim
Bom Yeoareum Gaeul Gyeoul Geurigo Bom,2003,103,"Drama, Romance",8,A boy is raised by a Buddhist monk in an isolated floating temple where the years pass like the seasons.,Ki-duk Kim,Ki-duk Kim,Yeong-su Oh,Jong-ho Kim,Kim Young-Min
Boogie Nights,1997,155,Drama,7.9,"Back when sex was safe, pleasure was a business and business was booming, an idealistic porn producer aspires to elevate his craft to an art when he discovers a hot young talent.",Paul Thomas Anderson,Mark Wahlberg,Julianne Moore,Burt Reynolds,Luis Guzmán
Boyhood,2014,165,Drama,7.9,"The life of Mason, from early childhood to his arrival at college.",Richard Linklater,Ellar Coltrane,Patricia Arquette,Ethan Hawke,Elijah Smith
Bridge of Spies,2015,142,"Drama, History, Thriller",7.6,"During the Cold War, an American lawyer is recruited to defend an arrested Soviet spy in court, and then help the CIA facilitate an exchange of the spy for the Soviet captured American U2 spy plane pilot, Francis Gary Powers.",Steven Spielberg,Tom Hanks,Mark Rylance,Alan Alda,Amy Ryan
Brokeback Mountain,2005,134,"Drama, Romance",7.7,"The story of a forbidden and secretive relationship between two cowboys, and their lives over the years.",Ang Lee,Jake Gyllenhaal,Heath Ledger,Michelle Williams,Randy Quaid
C.R.A.Z.Y.,2005,129,"Comedy, Drama",7.9,"A young French-Canadian, growing up in the 1960s and 1970s, struggles to reconcile his emerging homosexuality with his father's conservative values and his own Catholic beliefs.",Jean-Marc Vallée,Michel Côté,Marc-André Grondin,Danielle Proulx,Émile Vallée
Call Me by Your Name,2017,132,"Drama, Romance",7.9,"In 1980s Italy, romance blossoms between a seventeen-year-old student and the older man hired as his father's research assistant.",Luca Guadagnino,Armie Hammer,Timothée Chalamet,Michael Stuhlbarg,Amira Casar
Capharnaüm,2018,126,Drama,8.4,"While serving a five-year sentence for a violent crime, a 12-year-old boy sues his parents for neglect.",Nadine Labaki,Zain Al Rafeea,Yordanos Shiferaw,Boluwatife Treasure Bankole,Kawsar Al Haddad
Captain America: Civil War,2016,147,"Action, Adventure, Sci-Fi",7.8,Political involvement in the Avengers' affairs causes a rift between Captain America and Iron Man.,Anthony Russo,Joe Russo,Chris Evans,Robert Downey Jr.,Scarlett Johansson
Captain America: The Winter Soldier,2014,136,"Action, Adventure, Sci-Fi",7.7,"As Steve Rogers struggles to embrace his role in the modern world, he teams up with a fellow Avenger and S.H.I.E.L.D agent, Black Widow, to battle a new threat from history: an assassin known as the Winter Soldier.",Anthony Russo,Joe Russo,Chris Evans,Samuel L. Jackson,Scarlett Johansson
Captain Fantastic,2016,118,"Comedy, Drama",7.9,"In the forests of the Pacific Northwest, a father devoted to raising his six kids with a rigorous physical and intellectual education is forced to leave his paradise and enter the world, challenging his idea of what it means to be a parent.",Matt Ross,Viggo Mortensen,George MacKay,Samantha Isler,Annalise Basso
Captain Phillips,2013,134,"Adventure, Biography, Crime",7.8,"The true story of Captain Richard Phillips and the 2009 hijacking by Somali pirates of the U.S.-flagged MV Maersk Alabama, the first American cargo ship to be hijacked in two hundred years.",Paul Greengrass,Tom Hanks,Barkhad Abdi,Barkhad Abdirahman,Catherine Keener
Casino Royale,2006,144,"Action, Adventure, Thriller",8,"After earning 00 status and a licence to kill, Secret Agent James Bond sets out on his first mission as 007. Bond must defeat a private banker funding terrorists in a high-stakes game of poker at Casino Royale, Montenegro.",Martin Campbell,Daniel Craig,Eva Green,Judi Dench,Jeffrey Wright
Cast Away,2000,143,"Adventure, Drama, Romance",7.8,A FedEx executive undergoes a physical and emotional transformation after crash landing on a deserted island.,Robert Zemeckis,Tom Hanks,Helen Hunt,Paul Sanchez,Lari White
Catch Me If You Can,2002,141,"Biography, Crime, Drama",8.1,"Barely 21 yet, Frank is a skilled forger who has passed as a doctor, lawyer and pilot. FBI agent Carl becomes obsessed with tracking down the con man, who only revels in the pursuit.",Steven Spielberg,Leonardo DiCaprio,Tom Hanks,Christopher Walken,Martin Sheen
Celda 211,2009,113,"Action, Adventure, Crime",7.6,"The story of two men on different sides of a prison riot -- the inmate leading the rebellion and the young guard trapped in the revolt, who poses as a prisoner in a desperate attempt to survive the ordeal.",Daniel Monzón,Luis Tosar,Alberto Ammann,Antonio Resines,Manuel Morón
Central do Brasil,1998,110,Drama,8,"An emotive journey of a former school teacher, who writes letters for illiterate people, and a young boy, whose mother has just died, as they search for the father he never knew.",Walter Salles,Fernanda Montenegro,Vinícius de Oliveira,Marília Pêra,Soia Lira
Chak De! India,2007,153,"Drama, Family, Sport",8.2,Kabir Khan is the coach of the Indian Women's National Hockey Team and his dream is to make his all girls team emerge victorious against all odds.,Shimit Amin,Shah Rukh Khan,Vidya Malvade,Sagarika Ghatge,Shilpa Shukla
Changeling,2008,141,"Biography, Crime, Drama",7.7,Grief-stricken mother Christine Collins (Angelina Jolie) takes on the L.A.P.D. to her own detriment when it tries to pass off an obvious impostor as her missing child.,Clint Eastwood,Angelina Jolie,Colm Feore,Amy Ryan,Gattlin Griffith
Chhichhore,2019,143,"Comedy, Drama",8.2,"A tragic incident forces Anirudh, a middle-aged man, to take a trip down memory lane and reminisce his college days along with his friends, who were labelled as losers.",Nitesh Tiwari,Sushant Singh Rajput,Shraddha Kapoor,Varun Sharma,Prateik
Children of Men,2006,109,"Adventure, Drama, Sci-Fi",7.9,"In 2027, in a chaotic world in which women have become somehow infertile, a former activist agrees to help transport a miraculously pregnant woman to a sanctuary at sea.",Alfonso Cuarón,Julianne Moore,Clive Owen,Chiwetel Ejiofor,Michael Caine
Chugyeokja,2008,125,"Action, Crime, Thriller",7.8,A disgraced ex-policeman who runs a small ring of prostitutes finds himself in a race against time when one of his women goes missing.,Hong-jin Na,Kim Yoon-seok,Jung-woo Ha,Yeong-hie Seo,Yoo-Jeong Kim
