Series_Title,Released_Year,Runtime,Genre,Rating,Overview,Director,Star1,Star2,Star3,Star4
Sen to Chihiro no kamikakushi,2001,125,"Animation, Adventure, Family",8.6,"During her family's move to the suburbs, a sullen 10-year-old girl wanders into a world ruled by gods, witches, and spirits, and where humans are changed into beasts.",Hayao Miyazaki,Daveigh Chase,Suzanne Pleshette,Miyu Irino,Rumi Hiiragi
Serbuan maut,2011,101,"Action, Thriller",7.6,A S.W.A.T. team becomes trapped in a tenement run by a ruthless mobster and his army of killers and thugs.,Gareth Evans,Iko Uwais,Ananda George,Ray Sahetapy,Donny Alamsyah
Serbuan maut 2: Berandal,2014,150,"Action, Crime, Thriller",8,"Only a short time after the first raid, Rama goes undercover with the thugs of Jakarta and plans to bring down the syndicate and uncover the corruption within his police force.",Gareth Evans,Iko Uwais,Yayan Ruhian,Arifin Putra,Oka Antara
Serenity,2005,119,"Action, Adventure, Sci-Fi",7.8,The crew of the ship Serenity try to evade an assassin sent to recapture one of their members who is telepathic.,Joss Whedon,Nathan Fillion,Gina Torres,Chiwetel Ejiofor,Alan Tudyk
Seven Pounds,2008,123,Drama,7.6,A man with a fateful secret embarks on an extraordinary journey of redemption by forever changing the lives of seven strangers.,Gabriele Muccino,Will Smith,Rosario Dawson,Woody Harrelson,Michael Ealy
Shaun of the Dead,2004,99,"Comedy, Horror",7.9,A man's uneventful life is disrupted by the zombie apocalypse.,Edgar Wright,Simon Pegg,Nick Frost,Kate Ashfield,Lucy Davis
Sherlock Holmes,2009,128,"Action, Adventure, Mystery",7.6,Detective Sherlock Holmes and his stalwart partner Watson engage in a battle of wits and brawn with a nemesis whose plot is a threat to all of England.,Guy Ritchie,Robert Downey Jr.,Jude Law,Rachel McAdams,Mark Strong
"Shin seiki Evangelion Gekijô-ban: Air/Magokoro wo, kimi ni",1997,87,"Animation, Action, Drama",8.1,Concurrent theatrical ending of the TV series Shin seiki evangerion (1995).,Hideaki Anno,Kazuya Tsurumaki,Megumi Ogata,Megumi Hayashibara,Yûko Miyamura
Short Term 12,2013,96,Drama,8,A 20-something supervising staff member of a residential treatment facility navigates the troubled waters of that world alongside her co-worker and longtime boyfriend.,Destin Daniel Cretton,Brie Larson,Frantz Turner,John Gallagher Jr.,Kaitlyn Dever
Shrek,2001,90,"Animation, Adventure, Comedy",7.8,"A mean lord exiles fairytale creatures to the swamp of a grumpy ogre, who must go on a quest and rescue a princess for the lord in order to get his land back.",Andrew Adamson,Vicky Jenson,Mike Myers,Eddie Murphy,Cameron Diaz
Shutter Island,2010,138,"Mystery, Thriller",8.2,"In 1954, a U.S. Marshal investigates the disappearance of a murderer who escaped from a hospital for the criminally insane.",Martin Scorsese,Leonardo DiCaprio,Emily Mortimer,Mark Ruffalo,Ben Kingsley
Sicario,2015,121,"Action, Crime, Drama",7.6,An idealistic FBI agent is enlisted by a government task force to aid in the escalating war against drugs at the border area between the U.S. and Mexico.,Denis Villeneuve,Emily Blunt,Josh Brolin,Benicio Del Toro,Jon Bernthal
Silver Linings Playbook,2012,122,"Comedy, Drama, Romance",7.7,"After a stint in a mental institution, former teacher Pat Solitano moves back in with his parents and tries to reconcile with his ex-wife. Things get more challenging when Pat meets Tiffany, a mysterious girl with problems of her own.",David O. Russell,Bradley Cooper,Jennifer Lawrence,Robert De Niro,Jacki Weaver
Sin City,2005,124,"Crime, Thriller",8,"A movie that explores the dark and miserable town, Basin City, tells the story of three different people, all caught up in violent corruption.",Frank Miller,Quentin Tarantino,Robert Rodriguez,Mickey Rourke,Clive Owen
Sing Street,2016,106,"Comedy, Drama, Music",7.9,A boy growing up in Dublin during the 1980s escapes his strained family life by starting a band to impress the mysterious girl he likes.,John Carney,Ferdia Walsh-Peelo,Aidan Gillen,Maria Doyle Kennedy,Jack Reynor
Skyfall,2012,143,"Action, Adventure, Thriller",7.7,"James Bond's loyalty to M is tested when her past comes back to haunt her. When MI6 comes under attack, 007 must track down and destroy the threat, no matter how personal the cost.",Sam Mendes,Daniel Craig,Javier Bardem,Naomie Harris,Judi Dench
Slumdog Millionaire,2008,120,"Drama, Romance",8,"A Mumbai teenager reflects on his life after being accused of cheating on the Indian version of ""Who Wants to be a Millionaire?"".",Danny Boyle,Loveleen Tandan,Dev Patel,Freida Pinto,Saurabh Shukla
Snatch,2000,104,"Comedy, Crime",8.3,"Unscrupulous boxing promoters, violent bookmakers, a Russian gangster, incompetent amateur robbers and supposedly Jewish jewelers fight to track down a priceless stolen diamond.",Guy Ritchie,Jason Statham,Brad Pitt,Benicio Del Toro,Dennis Farina
Song of the Sea,2014,93,"Animation, Adventure, Drama",8.1,"Ben, a young Irish boy, and his little sister Saoirse, a girl who can turn into a seal, go on an adventure to free the fairies and save the spirit world.",Tomm Moore,David Rawle,Brendan Gleeson,Lisa Hannigan,Fionnula Flanagan
Soorarai Pottru,2020,153,Drama,8.6,"Nedumaaran Rajangam ""Maara"" sets out to make the common man fly and in the process takes on the world's most capital intensive industry and several enemies who stand in his way.",Sudha Kongara,Suriya,Madhavan,Paresh Rawal,Aparna Balamurali
Soul,2020,100,"Animation, Adventure, Comedy",8.1,"After landing the gig of a lifetime, a New York jazz pianist suddenly finds himself trapped in a strange land between Earth and the afterlife.",Pete Docter,Kemp Powers,Jamie Foxx,Tina Fey,Graham Norton
Sound of Metal,2019,120,"Drama, Music",7.8,A heavy-metal drummer's life is thrown into freefall when he begins to lose his hearing.,Darius Marder,Riz Ahmed,Olivia Cooke,Paul Raci,Lauren Ridloff
"South Park: Bigger, Longer & Uncut",1999,81,"Animation, Comedy, Fantasy",7.7,"When Stan Marsh and his friends go see an R-rated movie, they start cursing and their parents think that Canada is to blame.",Trey Parker,Trey Parker,Matt Stone,Mary Kay Bergman,Isaac Hayes
Special Chabbis,2013,144,"Crime, Drama, Thriller",8,A gang of con-men rob prominent rich businessmen and politicians by posing as C.B.I and income tax officers.,Neeraj Pandey,Akshay Kumar,Anupam Kher,Manoj Bajpayee,Jimmy Sheirgill
Spider-Man: Into the Spider-Verse,2018,117,"Animation, Action, Adventure",8.4,"Teen Miles Morales becomes the Spider-Man of his universe, and must join with five spider-powered individuals from other dimensions to stop a threat for all realities.",Bob Persichetti,Peter Ramsey,Rodney Rothman,Shameik Moore,Jake Johnson
Spotlight,2015,129,"Biography, Crime, Drama",8.1,"The true story of how the Boston Globe uncovered the massive scandal of child molestation and cover-up within the local Catholic Archdiocese, shaking the entire Catholic Church to its core.",Tom McCarthy,Mark Ruffalo,Michael Keaton,Rachel McAdams,Liev Schreiber
Star Trek,2009,127,"Action, Adventure, Sci-Fi",7.9,The brash James T. Kirk tries to live up to his father's legacy with Mr. Spock keeping him in check as a vengeful Romulan from the future creates black holes to destroy the Federation one planet at a time.,J.J. Abrams,Chris Pine,Zachary Quinto,Simon Pegg,Leonard Nimoy
Star Trek Into Darkness,2013,132,"Action, Adventure, Sci-Fi",7.7,"After the crew of the Enterprise find an unstoppable force of terror from within their own organization, Captain Kirk leads a manhunt to a war-zone world to capture a one-man weapon of mass destruction.",J.J. Abrams,Chris Pine,Zachary Quinto,Zoe Saldana,Benedict Cumberbatch
Star Wars: Episode VII - The Force Awakens,2015,138,"Action, Adventure, Sci-Fi",7.9,"As a new threat to the galaxy rises, Rey, a desert scavenger, and Finn, an ex-stormtrooper, must join Han Solo and Chewbacca to search for the one hope of restoring peace.",J.J. Abrams,Daisy Ridley,John Boyega,Oscar Isaac,Domhnall Gleeson
Stardust,2007,127,"Adventure, Family, Fantasy",7.6,"In a countryside town bordering on a magical land, a young man makes a promise to his beloved that he'll retrieve a fallen star by venturing into the magical realm.",Matthew Vaughn,Charlie Cox,Claire Danes,Sienna Miller,Ian McKellen
Straight Outta Compton,2015,147,"Biography, Drama, History",7.8,"The rap group NWA emerges from the mean streets of Compton in Los Angeles, California, in the mid-1980s and revolutionizes Hip Hop culture with their music and tales about life in the hood.",F. Gary Gray,O'Shea Jackson Jr.,Corey Hawkins,Jason Mitchell,Neil Brown Jr.
"Swades: We, the People",2004,210,Drama,8.2,A successful Indian scientist returns to an Indian village to take his nanny to America with him and in the process rediscovers his roots.,Ashutosh Gowariker,Shah Rukh Khan,Gayatri Joshi,Kishori Ballal,Smit Sheth
"Synecdoche, New York",2008,124,Drama,7.6,"A theatre director struggles with his work, and the women in his life, as he creates a life-size replica of New York City inside a warehouse as part of his new play.",Charlie Kaufman,Philip Seymour Hoffman,Samantha Morton,Michelle Williams,Catherine Keener
Tôkyô goddofâzâzu,2003,90,"Animation, Adventure, Comedy",7.8,"On Christmas Eve, three homeless people living on the streets of Tokyo discover a newborn baby among the trash and set out to find its parents.",Satoshi Kon,Shôgo Furuya,Tôru Emori,Yoshiaki Umegaki,Aya Okamoto
Taare Zameen Par,2007,165,"Drama, Family",8.4,"An eight-year-old boy is thought to be a lazy trouble-maker, until the new art teacher has the patience and compassion to discover the real problem behind his struggles in school.",Aamir Khan,Amole Gupte,Darsheel Safary,Aamir Khan,Tisca Chopra
Taegukgi hwinalrimyeo,2004,140,"Action, Drama, War",8.1,"When two brothers are forced to fight in the Korean War, the elder decides to take the riskiest missions if it will help shield the younger from battle.",Je-kyu Kang,Jang Dong-Gun,Won Bin,Eun-ju Lee,Hyeong-jin Kong
Taken,2008,90,"Action, Thriller",7.8,"A retired CIA agent travels across Europe and relies on his old skills to save his estranged daughter, who has been kidnapped while on a trip to Paris.",Pierre Morel,Liam Neeson,Maggie Grace,Famke Janssen,Leland Orser
Talvar,2015,132,"Crime, Drama, Mystery",8.2,An experienced investigator confronts several conflicting theories about the perpetrators of a violent double homicide.,Meghna Gulzar,Irrfan Khan,Konkona Sen Sharma,Neeraj Kabi,Sohum Shah
Tangled,2010,100,"Animation, Adventure, Comedy",7.7,"The magically long-haired Rapunzel has spent her entire life in a tower, but now that a runaway thief has stumbled upon her, she is about to discover the world for the first time, and who she really is.",Nathan Greno,Byron Howard,Mandy Moore,Zachary Levi,Donna Murphy
The Artist,2011,100,"Comedy, Drama, Romance",7.9,An egomaniacal film star develops a relationship with a young dancer against the backdrop of Hollywood's silent era.,Michel Hazanavicius,Jean Dujardin,Bérénice Bejo,John Goodman,James Cromwell
The Avengers,2012,143,"Action, Adventure, Sci-Fi",8,Earth's mightiest heroes must come together and learn to fight as a team if they are going to stop the mischievous Loki and his alien army from enslaving humanity.,Joss Whedon,Robert Downey Jr.,Chris Evans,Scarlett Johansson,Jeremy Renner
The Big Lebowski,1998,117,"Comedy, Crime, Sport",8.1,"Jeff ""The Dude"" Lebowski, mistaken for a millionaire of the same name, seeks restitution for his ruined rug and enlists his bowling buddies to help get it.",Joel Coen,Ethan Coen,Jeff Bridges,John Goodman,Julianne Moore
The Big Short,2015,130,"Biography, Comedy, Drama",7.8,In 2006-2007 a group of investors bet against the US mortgage market. In their research they discover how flawed and corrupt the market is.,Adam McKay,Christian Bale,Steve Carell,Ryan Gosling,Brad Pitt
The Blind Side,2009,129,"Biography, Drama, Sport",7.6,"The story of Michael Oher, a homeless and traumatized boy who became an All-American football player and first-round NFL draft pick with the help of a caring woman and her family.",John Lee Hancock,Quinton Aaron,Sandra Bullock,Tim McGraw,Jae Head
The Boondock Saints,1999,108,"Action, Crime, Thriller",7.8,Two Irish Catholic brothers become vigilantes and wipe out Boston's criminal underworld in the name of God.,Troy Duffy,Willem Dafoe,Sean Patrick Flanery,Norman Reedus,David Della Rocco
The Bourne Identity,2002,119,"Action, Mystery, Thriller",7.9,"A man is picked up by a fishing boat, bullet-riddled and suffering from amnesia, before racing to elude assassins and attempting to regain his memory.",Doug Liman,Franka Potente,Matt Damon,Chris Cooper,Clive Owen
The Bourne Supremacy,2004,108,"Action, Mystery, Thriller",7.7,"When Jason Bourne is framed for a CIA operation gone awry, he is forced to resume his former life as a trained assassin to survive.",Paul Greengrass,Matt Damon,Franka Potente,Joan Allen,Brian Cox
The Bourne Ultimatum,2007,115,"Action, Mystery, Thriller",8,Jason Bourne dodges a ruthless C.I.A. official and his Agents from a new assassination program while searching for the origins of his life as a trained killer.,Paul Greengrass,Matt Damon,Edgar Ramírez,Joan Allen,Julia Stiles
The Boy in the Striped Pyjamas,2008,94,"Drama, History, War",7.8,"Through the innocent eyes of Bruno, the eight-year-old son of the commandant at a German concentration camp, a forbidden friendship with a Jewish boy on the other side of the camp fence has startling and unexpected consequences.",Mark Herman,Asa Butterfield,David Thewlis,Rupert Friend,Zac Mattoon O'Brien
The Broken Circle Breakdown,2012,111,"Drama, Music, Romance",7.7,"Elise and Didier fall in love at first sight, in spite of their differences. He talks, she listens. He's a romantic atheist, she's a religious realist. When their daughter becomes seriously ill, their love is put on trial.",Felix van Groeningen,Veerle Baetens,Johan Heldenbergh,Nell Cattrysse,Geert Van Rampelberg
The Butterfly Effect,2004,113,"Drama, Sci-Fi, Thriller",7.6,"Evan Treborn suffers blackouts during significant events of his life. As he grows up, he finds a way to remember these lost memories and a supernatural way to alter his life by reading his journal.",Eric Bress,J. Mackye Gruber,Ashton Kutcher,Amy Smart,Melora Walters
The Count of Monte Cristo,2002,131,"Action, Adventure, Drama",7.8,"A young man, falsely imprisoned by his jealous ""friend"", escapes and uses a hidden treasure to exact his revenge.",Kevin Reynolds,Jim Caviezel,Guy Pearce,Christopher Adamson,JB Blanc
The Curious Case of Benjamin Button,2008,166,"Drama, Fantasy, Romance",7.8,"Tells the story of Benjamin Button, a man who starts aging backwards with consequences.",David Fincher,Brad Pitt,Cate Blanchett,Tilda Swinton,Julia Ormond
The Dark Knight,2008,152,"Action, Crime, Drama",9,"When the menace known as the Joker wreaks havoc and chaos on the people of Gotham, Batman must accept one of the greatest psychological and physical tests of his ability to fight injustice.",Christopher Nolan,Christian Bale,Heath Ledger,Aaron Eckhart,Michael Caine
The Dark Knight Rises,2012,164,"Action, Adventure",8.4,"Eight years after the Joker's reign of anarchy, Batman, with the help of the enigmatic Catwoman, is forced from his exile to save Gotham City from the brutal guerrilla terrorist Bane.",Christopher Nolan,Christian Bale,Tom Hardy,Anne Hathaway,Gary Oldman
The Departed,2006,151,"Crime, Drama, Thriller",8.5,An undercover cop and a mole in the police attempt to identify each other while infiltrating an Irish gang in South Boston.,Martin Scorsese,Leonardo DiCaprio,Matt Damon,Jack Nicholson,Mark Wahlberg
The Fall,2006,117,"Adventure, Drama, Fantasy",7.9,"In a hospital on the outskirts of 1920s Los Angeles, an injured stuntman begins to tell a fellow patient, a little girl with a broken arm, a fantastic story of five mythical heroes. Thanks to his fractured state of mind and her vivid imagination, the line between fiction and reality blurs as the tale advances.",Tarsem Singh,Lee Pace,Catinca Untaru,Justine Waddell,Kim Uylenbroek
The Fault in Our Stars,2014,126,"Drama, Romance",7.7,Two teenage cancer patients begin a life-affirming journey to visit a reclusive author in Amsterdam.,Josh Boone,Shailene Woodley,Ansel Elgort,Nat Wolff,Laura Dern
The Fifth Element,1997,126,"Action, Adventure, Sci-Fi",7.7,"In the colorful future, a cab driver unwittingly becomes the central figure in the search for a legendary cosmic weapon to keep Evil and Mr. Zorg at bay.",Luc Besson,Bruce Willis,Milla Jovovich,Gary Oldman,Ian Holm
The Fighter,2010,116,"Biography, Drama, Sport",7.8,"Based on the story of Micky Ward, a fledgling boxer who tries to escape the shadow of his more famous but troubled older boxing brother and get his own shot at greatness.",David O. Russell,Mark Wahlberg,Christian Bale,Amy Adams,Melissa Leo
The Florida Project,2017,111,Drama,7.6,"Set over one summer, the film follows precocious six-year-old Moonee as she courts mischief and adventure with her ragtag playmates and bonds with her rebellious but caring mother, all while living in the shadows of Walt Disney World.",Sean Baker,Brooklynn Prince,Bria Vinaite,Willem Dafoe,Christopher Rivera
The Game,1997,129,"Action, Drama, Mystery",7.8,"After a wealthy banker is given an opportunity to participate in a mysterious game, his life is turned upside down when he becomes unable to distinguish between the game and reality.",David Fincher,Michael Douglas,Deborah Kara Unger,Sean Penn,James Rebhorn
The Gentlemen,2019,113,"Action, Comedy, Crime",7.8,"An American expat tries to sell off his highly profitable marijuana empire in London, triggering plots, schemes, bribery and blackmail in an attempt to steal his domain out from under him.",Guy Ritchie,Matthew McConaughey,Charlie Hunnam,Michelle Dockery,Jeremy Strong
The Girl with the Dragon Tattoo,2011,158,"Crime, Drama, Mystery",7.8,"Journalist Mikael Blomkvist is aided in his search for a woman who has been missing for forty years by Lisbeth Salander, a young computer hacker.",David Fincher,Daniel Craig,Rooney Mara,Christopher Plummer,Stellan Skarsgård
The Grand Budapest Hotel,2014,99,"Adventure, Comedy, Crime",8.1,"A writer encounters the owner of an aging high-class hotel, who tells him of his early years serving as a lobby boy in the hotel's glorious years under an exceptional concierge.",Wes Anderson,Ralph Fiennes,F. Murray Abraham,Mathieu Amalric,Adrien Brody
The Green Mile,1999,189,"Crime, Drama, Fantasy",8.6,"The lives of guards on Death Row are affected by one of their charges: a black man accused of child murder and rape, yet who has a mysterious gift.",Frank Darabont,Tom Hanks,Michael Clarke Duncan,David Morse,Bonnie Hunt
The Hangover,2009,100,Comedy,7.7,"Three buddies wake up from a bachelor party in Las Vegas, with no memory of the previous night and the bachelor missing. They make their way around the city in order to find their friend before his wedding.",Todd Phillips,Zach Galifianakis,Bradley Cooper,Justin Bartha,Ed Helms
The Hateful Eight,2015,168,"Crime, Drama, Mystery",7.8,"In the dead of a Wyoming winter, a bounty hunter and his prisoner find shelter in a cabin currently inhabited by a collection of nefarious characters.",Quentin Tarantino,Samuel L. Jackson,Kurt Russell,Jennifer Jason Leigh,Walton Goggins
The Help,2011,146,Drama,8,"An aspiring author during the civil rights movement of the 1960s decides to write a book detailing the African American maids' point of view on the white families for which they work, and the hardships they go through on a daily basis.",Tate Taylor,Emma Stone,Viola Davis,Octavia Spencer,Bryce Dallas Howard
The Hobbit: An Unexpected Journey,2012,169,"Adventure, Fantasy",7.8,"A reluctant Hobbit, Bilbo Baggins, sets out to the Lonely Mountain with a spirited group of dwarves to reclaim their mountain home, and the gold within it from the dragon Smaug.",Peter Jackson,Martin Freeman,Ian McKellen,Richard Armitage,Andy Serkis
The Hobbit: The Desolation of Smaug,2013,161,"Adventure, Fantasy",7.8,"The dwarves, along with Bilbo Baggins and Gandalf the Grey, continue their quest to reclaim Erebor, their homeland, from Smaug. Bilbo Baggins is in possession of a mysterious and magical ring.",Peter Jackson,Ian McKellen,Martin Freeman,Richard Armitage,Ken Stott
The Hurricane,1999,146,"Biography, Drama, Sport",7.6,"The story of Rubin 'Hurricane' Carter, a boxer wrongly imprisoned for murder, and the people who aided in his fight to prove his innocence.",Norman Jewison,Denzel Washington,Vicellous Shannon,Deborah Kara Unger,Liev Schreiber
The Illusionist,2006,110,"Drama, Fantasy, Mystery",7.6,"In turn-of-the-century Vienna, a magician uses his abilities to secure the love of a woman far above his social standing.",Neil Burger,Edward Norton,Jessica Biel,Paul Giamatti,Rufus Sewell
The Imitation Game,2014,114,"Biography, Drama, Thriller",8,"During World War II, the English mathematical genius Alan Turing tries to crack the German Enigma code with help from fellow mathematicians.",Morten Tyldum,Benedict Cumberbatch,Keira Knightley,Matthew Goode,Allen Leech
The Incredibles,2004,115,"Animation, Action, Adventure",8,"A family of undercover superheroes, while trying to live the quiet suburban life, are forced into action to save the world.",Brad Bird,Craig T. Nelson,Samuel L. Jackson,Holly Hunter,Jason Lee
The Insider,1999,157,"Biography, Drama, Thriller",7.8,A research chemist comes under personal and professional attack when he decides to appear in a 60 Minutes exposé on Big Tobacco.,Michael Mann,Russell Crowe,Al Pacino,Christopher Plummer,Diane Venora
The Intouchables,2011,112,"Biography, Comedy, Drama",8.5,"After he becomes a quadriplegic from a paragliding accident, an aristocrat hires a young man from the projects to be his caregiver.",Olivier Nakache,Éric Toledano,François Cluzet,Omar Sy,Anne Le Ny
The Irishman,2019,209,"Biography, Crime, Drama",7.9,"An old man recalls his time painting houses for his friend, Jimmy Hoffa, through the 1950-70s.",Martin Scorsese,Robert De Niro,Al Pacino,Joe Pesci,Harvey Keitel
The Iron Giant,1999,86,"Animation, Action, Adventure",8,A young boy befriends a giant robot from outer space that a paranoid government agent wants to destroy.,Brad Bird,Eli Marienthal,Harry Connick Jr.,Jennifer Aniston,Vin Diesel
The King's Speech,2010,118,"Biography, Drama, History",8,"The story of King George VI, his impromptu ascension to the throne of the British Empire in 1936, and the speech therapist who helped the unsure monarch overcome his stammer.",Tom Hooper,Colin Firth,Geoffrey Rush,Helena Bonham Carter,Derek Jacobi
The Last King of Scotland,2006,123,"Biography, Drama, History",7.7,Based on the events of the brutal Ugandan dictator Idi Amin's regime as seen by his personal physician during the 1970s.,Kevin Macdonald,James McAvoy,Forest Whitaker,Gillian Anderson,Kerry Washington
The Last Samurai,2003,154,"Action, Drama",7.7,An American military advisor embraces the Samurai culture he was hired to destroy after he is captured in battle.,Edward Zwick,Tom Cruise,Ken Watanabe,Billy Connolly,William Atherton
The Lego Movie,2014,100,"Animation, Action, Adventure",7.7,"An ordinary LEGO construction worker, thought to be the prophesied as ""special"", is recruited to join a quest to stop an evil tyrant from gluing the LEGO universe into eternal stasis.",Christopher Miller,Phil Lord,Chris Pratt,Will Ferrell,Elizabeth Banks
The Lives of Others,2006,137,"Drama, Mystery, Thriller",8.4,"In 1984 East Berlin, an agent of the secret police, conducting surveillance on a writer and his lover, finds himself becoming increasingly absorbed by their lives.",Florian Henckel von Donnersmarck,Ulrich Mühe,Martina Gedeck,Sebastian Koch,Ulrich Tukur
The Lord of the Rings: The Fellowship of the Ring,2001,178,"Action, Adventure, Drama",8.8,A meek Hobbit from the Shire and eight companions set out on a journey to destroy the powerful One Ring and save Middle-earth from the Dark Lord Sauron.,Peter Jackson,Elijah Wood,Ian McKellen,Orlando Bloom,Sean Bean
The Lord of the Rings: The Return of the King,2003,201,"Action, Adventure, Drama",8.9,Gandalf and Aragorn lead the World of Men against Sauron's army to draw his gaze from Frodo and Sam as they approach Mount Doom with the One Ring.,Peter Jackson,Elijah Wood,Viggo Mortensen,Ian McKellen,Orlando Bloom
The Lord of the Rings: The Two Towers,2002,179,"Action, Adventure, Drama",8.7,"While Frodo and Sam edge closer to Mordor with the help of the shifty Gollum, the divided fellowship makes a stand against Sauron's new ally, Saruman, and his hordes of Isengard.",Peter Jackson,Elijah Wood,Ian McKellen,Viggo Mortensen,Orlando Bloom
The Lunchbox,2013,104,"Drama, Romance",7.8,A mistaken delivery in Mumbai's famously efficient lunchbox delivery system connects a young housewife to an older man in the dusk of his life as they build a fantasy world together through notes in the lunchbox.,Ritesh Batra,Irrfan Khan,Nimrat Kaur,Nawazuddin Siddiqui,Lillete Dubey
The Machinist,2004,101,"Drama, Thriller",7.7,An industrial worker who hasn't slept in a year begins to doubt his own sanity.,Brad Anderson,Christian Bale,Jennifer Jason Leigh,Aitana Sánchez-Gijón,John Sharian
The Magdalene Sisters,2002,114,Drama,7.7,Three young Irish women struggle to maintain their spirits while they endure dehumanizing abuse as inmates of a Magdalene Sisters Asylum.,Peter Mullan,Eileen Walsh,Dorothy Duffy,Nora-Jane Noone,Anne-Marie Duff
The Man from Earth,2007,87,"Drama, Fantasy, Mystery",7.9,An impromptu goodbye party for Professor John Oldman becomes a mysterious interrogation after the retiring scholar reveals to his colleagues he has a longer and stranger past than they can imagine.,Richard Schenkman,David Lee Smith,Tony Todd,John Billingsley,Ellen Crawford
