Series_Title,Released_Year,Runtime,Genre,Rating,Overview,Director,Star1,Star2,Star3,Star4
Cidade de Deus,2002,130,"Crime, Drama",8.6,"In the slums of Rio, two kids' paths diverge as one struggles to become a photographer and the other a kingpin.",Fernando Meirelles,Kátia Lund,Alexandre Rodrigues,Leandro Firmino,Matheus Nachtergaele
Cinderella Man,2005,144,"Biography, Drama, History",8,"The story of James J. Braddock, a supposedly washed-up boxer who came back to become a champion and an inspiration in the 1930s.",Ron Howard,Russell Crowe,Renée Zellweger,Craig Bierko,Paul Giamatti
Coco,2017,105,"Animation, Adventure, Family",8.4,"Aspiring musician Miguel, confronted with his family's ancestral ban on music, enters the Land of the Dead to find his great-great-grandfather, a legendary singer.",Lee Unkrich,Adrian Molina,Anthony Gonzalez,Gael García Bernal,Benjamin Bratt
Contratiempo,2016,106,"Crime, Drama, Mystery",8.1,A successful entrepreneur accused of murder and a witness preparation expert have less than three hours to come up with an impregnable defense.,Oriol Paulo,Mario Casas,Ana Wagener,Jose Coronado,Bárbara Lennie
Control,2007,122,"Biography, Drama, Music",7.7,"A profile of Ian Curtis, the enigmatic singer of Joy Division whose personal, professional, and romantic troubles led him to commit suicide at the age of 23.",Anton Corbijn,Sam Riley,Samantha Morton,Craig Parkinson,Alexandra Maria Lara
Coraline,2009,100,"Animation, Drama, Family",7.7,"An adventurous 11-year-old girl finds another world that is a strangely idealized version of her frustrating home, but it has sinister secrets.",Henry Selick,Dakota Fanning,Teri Hatcher,John Hodgman,Jennifer Saunders
Cowboy Bebop: Tengoku no tobira,2001,115,"Animation, Action, Crime",7.9,"A terrorist explosion releases a deadly virus on the masses, and it's up the bounty-hunting Bebop crew to catch the cold-blooded culprit.",Shin'ichirô Watanabe,Tensai Okamura,Hiroyuki Okiura,Yoshiyuki Takei,Beau Billingslea
Crash,2004,112,"Crime, Drama, Thriller",7.7,"Los Angeles citizens with vastly separate lives collide in interweaving stories of race, loss and redemption.",Paul Haggis,Don Cheadle,Sandra Bullock,Thandie Newton,Karina Arroyave
Creed,2015,133,"Drama, Sport",7.6,"The former World Heavyweight Champion Rocky Balboa serves as a trainer and mentor to Adonis Johnson, the son of his late friend and former rival Apollo Creed.",Ryan Coogler,Michael B. Jordan,Sylvester Stallone,Tessa Thompson,Phylicia Rashad
"Crna macka, beli macor",1998,127,"Comedy, Crime, Romance",8.1,Matko and his son Zare live on the banks of the Danube river and get by through hustling and basically doing anything to make a living. In order to pay off a business debt Matko agrees to marry off Zare to the sister of a local gangster.,Emir Kusturica,Bajram Severdzan,Srdjan 'Zika' Todorovic,Branka Katic,Florijan Ajdini
Dallas Buyers Club,2013,117,"Biography, Drama",8,"In 1985 Dallas, electrician and hustler Ron Woodroof works around the system to help AIDS patients get the medication they need after he is diagnosed with the disease.",Jean-Marc Vallée,Matthew McConaughey,Jennifer Garner,Jared Leto,Steve Zahn
Dancer in the Dark,2000,140,"Crime, Drama, Musical",8,"An East European girl travels to the United States with her young son, expecting it to be like a Hollywood film.",Lars von Trier,Björk,Catherine Deneuve,David Morse,Peter Stormare
Dangal,2016,161,"Action, Biography, Drama",8.4,Former wrestler Mahavir Singh Phogat and his two wrestler daughters struggle towards glory at the Commonwealth Games in the face of societal oppression.,Nitesh Tiwari,Aamir Khan,Sakshi Tanwar,Fatima Sana Shaikh,Sanya Malhotra
Darbareye Elly,2009,119,"Drama, Mystery",8,The mysterious disappearance of a kindergarten teacher during a picnic in the north of Iran is followed by a series of misadventures for her fellow travelers.,Asghar Farhadi,Golshifteh Farahani,Shahab Hosseini,Taraneh Alidoosti,Merila Zare'i
Dark City,1998,100,"Mystery, Sci-Fi, Thriller",7.6,"A man struggles with memories of his past, which include a wife he cannot remember and a nightmarish world no one else ever seems to wake up from.",Alex Proyas,Rufus Sewell,Kiefer Sutherland,Jennifer Connelly,William Hurt
Dark Waters,2019,126,"Biography, Drama, History",7.6,A corporate defense attorney takes on an environmental lawsuit against a chemical company that exposes a lengthy history of pollution.,Todd Haynes,Mark Ruffalo,Anne Hathaway,Tim Robbins,Bill Pullman
Das Experiment,2001,120,"Drama, Thriller",7.7,"For two weeks, 20 male participants are hired to play prisoners and guards in a prison. The ""prisoners"" have to follow seemingly mild rules, and the ""guards"" are told to retain order without using physical violence.",Oliver Hirschbiegel,Moritz Bleibtreu,Christian Berkel,Oliver Stokowski,Wotan Wilke Möhring
Das weiße Band - Eine deutsche Kindergeschichte,2009,144,"Drama, History, Mystery",7.8,"Strange events happen in a small village in the north of Germany during the years before World War I, which seem to be ritual punishment. Who is responsible?",Michael Haneke,Christian Friedel,Ernst Jacobi,Leonie Benesch,Ulrich Tukur
Dawn of the Planet of the Apes,2014,130,"Action, Adventure, Drama",7.6,A growing nation of genetically evolved apes led by Caesar is threatened by a band of human survivors of the devastating virus unleashed a decade earlier.,Matt Reeves,Gary Oldman,Keri Russell,Andy Serkis,Kodi Smit-McPhee
Dead Man's Shoes,2004,90,"Crime, Drama, Thriller",7.6,A disaffected soldier returns to his hometown to get even with the thugs who brutalized his mentally-challenged brother years ago.,Shane Meadows,Paddy Considine,Gary Stretch,Toby Kebbell,Stuart Wolfenden
Deadpool,2016,108,"Action, Adventure, Comedy",8,"A wisecracking mercenary gets experimented on and becomes immortal but ugly, and sets out to track down the man who ruined his looks.",Tim Miller,Ryan Reynolds,Morena Baccarin,T.J. Miller,Ed Skrein
Deadpool 2,2018,119,"Action, Adventure, Comedy",7.7,"Foul-mouthed mutant mercenary Wade Wilson (a.k.a. Deadpool), brings together a team of fellow mutant rogues to protect a young boy with supernatural abilities from the brutal, time-traveling cyborg Cable.",David Leitch,Ryan Reynolds,Josh Brolin,Morena Baccarin,Julian Dennison
Death Note: Desu nôto,2006,126,"Crime, Drama, Fantasy",7.7,"A battle between the world's two greatest minds begins when Light Yagami finds the Death Note, a notebook with the power to kill, and decides to rid the world of criminals.",Shûsuke Kaneko,Tatsuya Fujiwara,Ken'ichi Matsuyama,Asaka Seto,Yû Kashii
Der Untergang,2004,156,"Biography, Drama, History",8.2,"Traudl Junge, the final secretary for Adolf Hitler, tells of the Nazi dictator's final days in his Berlin bunker at the end of WWII.",Oliver Hirschbiegel,Bruno Ganz,Alexandra Maria Lara,Ulrich Matthes,Juliane Köhler
Despicable Me,2010,95,"Animation, Comedy, Crime",7.6,"When a criminal mastermind uses a trio of orphan girls as pawns for a grand scheme, he finds their love is profoundly changing him for the better.",Pierre Coffin,Chris Renaud,Steve Carell,Jason Segel,Russell Brand
Detachment,2011,98,Drama,7.7,A substitute teacher who drifts from classroom to classroom finds a connection to the students and teachers during his latest assignment.,Tony Kaye,Adrien Brody,Christina Hendricks,Marcia Gay Harden,Lucy Liu
Dev.D,2009,144,"Drama, Romance",8,"After breaking up with his childhood sweetheart, a young man finds solace in drugs. Meanwhile, a teenage girl is caught in the world of prostitution. Will they be destroyed, or will they find redemption?",Anurag Kashyap,Abhay Deol,Mahie Gill,Kalki Koechlin,Dibyendu Bhattacharya
Diarios de motocicleta,2004,126,"Adventure, Biography, Drama",7.8,The dramatization of a motorcycle road trip Che Guevara went on in his youth that showed him his life's calling.,Walter Salles,Gael García Bernal,Rodrigo De la Serna,Mía Maestro,Mercedes Morán
Die Welle,2008,107,"Drama, Thriller",7.6,A high school teacher's experiment to demonstrate to his students what life is like under a dictatorship spins horribly out of control when he forms a social unit with a life of its own.,Dennis Gansel,Jürgen Vogel,Frederick Lau,Max Riemelt,Jennifer Ulrich
Dil Bechara,2020,101,"Comedy, Drama, Romance",7.9,"The emotional journey of two hopelessly in love youngsters, a young girl, Kizie, suffering from cancer, and a boy, Manny, whom she meets at a support group.",Mukesh Chhabra,Sushant Singh Rajput,Sanjana Sanghi,Sahil Vaid,Saswata Chatterjee
Dil Chahta Hai,2001,183,"Comedy, Drama, Romance",8.1,"Three inseparable childhood friends are just out of college. Nothing comes between them - until they each fall in love, and their wildly different approaches to relationships creates tension.",Farhan Akhtar,Aamir Khan,Saif Ali Khan,Akshaye Khanna,Preity Zinta
District 9,2009,112,"Action, Sci-Fi, Thriller",7.9,Violence ensues after an extraterrestrial race forced to live in slum-like conditions on Earth finds a kindred spirit in a government agent exposed to their biotechnology.,Neill Blomkamp,Sharlto Copley,David James,Jason Cope,Nathalie Boltt
Django Unchained,2012,165,"Drama, Western",8.4,"With the help of a German bounty hunter, a freed slave sets out to rescue his wife from a brutal Mississippi plantation owner.",Quentin Tarantino,Jamie Foxx,Christoph Waltz,Leonardo DiCaprio,Kerry Washington
Dogville,2003,178,"Crime, Drama",8,"A woman on the run from the mob is reluctantly accepted in a small Colorado community in exchange for labor, but when a search visits the town she finds out that their support has a price.",Lars von Trier,Nicole Kidman,Paul Bettany,Lauren Bacall,Harriet Andersson
Donnie Brasco,1997,127,"Biography, Crime, Drama",7.7,"An FBI undercover agent infiltrates the mob and finds himself identifying more with the mafia life, at the expense of his regular one.",Mike Newell,Al Pacino,Johnny Depp,Michael Madsen,Bruno Kirby
Donnie Darko,2001,113,"Drama, Mystery, Sci-Fi",8,"After narrowly escaping a bizarre accident, a troubled teenager is plagued by visions of a man in a large rabbit suit who manipulates him to commit a series of crimes.",Richard Kelly,Jake Gyllenhaal,Jena Malone,Mary McDonnell,Holmes Osborne
Drishyam,2013,160,"Crime, Drama, Thriller",8.3,A man goes to extreme lengths to save his family from punishment after the family commits an accidental crime.,Jeethu Joseph,Mohanlal,Meena,Asha Sharath,Ansiba
Drishyam,2015,163,"Crime, Drama, Mystery",8.2,"Desperate measures are taken by a man who tries to save his family from the dark side of the law, after they commit an unexpected crime.",Nishikant Kamat,Ajay Devgn,Shriya Saran,Tabu,Rajat Kapoor
Drive,2011,100,"Crime, Drama",7.8,A mysterious Hollywood stuntman and mechanic moonlights as a getaway driver and finds himself in trouble when he helps out his neighbor.,Nicolas Winding Refn,Ryan Gosling,Carey Mulligan,Bryan Cranston,Albert Brooks
Druk,2020,117,"Comedy, Drama",7.8,"Four friends, all high school teachers, test a theory that they will improve their lives by maintaining a constant level of alcohol in their blood.",Thomas Vinterberg,Mads Mikkelsen,Thomas Bo Larsen,Magnus Millang,Lars Ranthe
Dunkirk,2017,106,"Action, Drama, History",7.8,"Allied soldiers from Belgium, the British Empire, and France are surrounded by the German Army and evacuated during a fierce battle in World War II.",Christopher Nolan,Fionn Whitehead,Barry Keoghan,Mark Rylance,Tom Hardy
Eastern Promises,2007,100,"Action, Crime, Drama",7.6,A teenager who dies during childbirth leaves clues in her journal that could tie her child to a rape involving a violent Russian mob family.,David Cronenberg,Naomi Watts,Viggo Mortensen,Armin Mueller-Stahl,Josef Altin
Edge of Tomorrow,2014,113,"Action, Adventure, Sci-Fi",7.9,"A soldier fighting aliens gets to relive the same day over and over again, the day restarting every time he dies.",Doug Liman,Tom Cruise,Emily Blunt,Bill Paxton,Brendan Gleeson
Efter brylluppet,2006,120,Drama,7.7,"A manager of an orphanage in India is sent to Copenhagen, Denmark, where he discovers a life-altering family secret.",Susanne Bier,Mads Mikkelsen,Sidse Babett Knudsen,Rolf Lassgård,Neeral Mulchandani
El cuerpo,2012,112,"Mystery, Thriller",7.6,A detective searches for the body of a femme fatale which has gone missing from a morgue.,Oriol Paulo,Jose Coronado,Hugo Silva,Belén Rueda,Aura Garrido
El secreto de sus ojos,2009,129,"Drama, Mystery, Romance",8.2,A retired legal counselor writes a novel hoping to find closure for one of his past unresolved homicide cases and for his unreciprocated love with his superior - both of which still haunt him decades later.,Juan José Campanella,Ricardo Darín,Soledad Villamil,Pablo Rago,Carla Quevedo
En man som heter Ove,2015,116,"Comedy, Drama, Romance",7.7,"Ove, an ill-tempered, isolated retiree who spends his days enforcing block association rules and visiting his wife's grave, has finally given up on life just as an unlikely friendship develops with his boisterous new neighbors.",Hannes Holm,Rolf Lassgård,Bahar Pars,Filip Berg,Ida Engvoll
End of Watch,2012,109,"Action, Crime, Drama",7.6,"Shot documentary-style, this film follows the daily grind of two young police officers in LA who are partners and friends, and what happens when they meet criminal forces greater than themselves.",David Ayer,Jake Gyllenhaal,Michael Peña,Anna Kendrick,America Ferrera
Enemy at the Gates,2001,131,"Drama, History, War",7.6,A Russian and a German sniper play a game of cat-and-mouse during the Battle of Stalingrad.,Jean-Jacques Annaud,Jude Law,Ed Harris,Joseph Fiennes,Rachel Weisz
English Vinglish,2012,134,"Comedy, Drama, Family",7.8,"A quiet, sweet tempered housewife endures small slights from her well-educated husband and daughter every day because of her inability to speak and understand English.",Gauri Shinde,Sridevi,Adil Hussain,Mehdi Nebbou,Priya Anand
Eternal Sunshine of the Spotless Mind,2004,108,"Drama, Romance, Sci-Fi",8.3,"When their relationship turns sour, a couple undergoes a medical procedure to have each other erased from their memories.",Michel Gondry,Jim Carrey,Kate Winslet,Tom Wilkinson,Gerry Robert Byrne
Ex Machina,2014,108,"Drama, Sci-Fi, Thriller",7.7,A young programmer is selected to participate in a ground-breaking experiment in synthetic intelligence by evaluating the human qualities of a highly advanced humanoid A.I.,Alex Garland,Alicia Vikander,Domhnall Gleeson,Oscar Isaac,Sonoya Mizuno
Fa yeung nin wah,2000,98,"Drama, Romance",8.1,"Two neighbors, a woman and a man, form a strong bond after both suspect extramarital activities of their spouses. However, they agree to keep their bond platonic so as not to commit similar wrongs.",Kar-Wai Wong,Tony Chiu-Wai Leung,Maggie Cheung,Ping Lam Siu,Tung Cho 'Joe' Cheung
Fantastic Mr. Fox,2009,87,"Animation, Adventure, Comedy",7.9,An urbane fox cannot resist returning to his farm raiding ways and then must help his community survive the farmers' retaliation.,Wes Anderson,George Clooney,Meryl Streep,Bill Murray,Jason Schwartzman
Fear and Loathing in Las Vegas,1998,118,"Adventure, Comedy, Drama",7.6,An oddball journalist and his psychopathic lawyer travel to Las Vegas for a series of psychedelic escapades.,Terry Gilliam,Johnny Depp,Benicio Del Toro,Tobey Maguire,Michael Lee Gogin
Festen,1998,105,Drama,8,"At Helge's 60th birthday party, some unpleasant family truths are revealed.",Thomas Vinterberg,Ulrich Thomsen,Henning Moritzen,Thomas Bo Larsen,Paprika Steen
Fight Club,1999,139,Drama,8.8,"An insomniac office worker and a devil-may-care soapmaker form an underground fight club that evolves into something much, much more.",David Fincher,Brad Pitt,Edward Norton,Meat Loaf,Zach Grenier
Finding Nemo,2003,100,"Animation, Adventure, Comedy",8.1,"After his son is captured in the Great Barrier Reef and taken to Sydney, a timid clownfish sets out on a journey to bring him home.",Andrew Stanton,Lee Unkrich,Albert Brooks,Ellen DeGeneres,Alexander Gould
Finding Neverland,2004,106,"Biography, Drama, Family",7.6,The story of Sir J.M. Barrie's friendship with a family who inspired him to create Peter Pan.,Marc Forster,Johnny Depp,Kate Winslet,Julie Christie,Radha Mitchell
Flipped,2010,90,"Comedy, Drama, Romance",7.7,Two eighth-graders start to have feelings for each other despite being total opposites.,Rob Reiner,Madeline Carroll,Callan McAuliffe,Rebecca De Mornay,Anthony Edwards
Ford v Ferrari,2019,152,"Action, Biography, Drama",8.1,American car designer Carroll Shelby and driver Ken Miles battle corporate interference and the laws of physics to build a revolutionary race car for Ford in order to defeat Ferrari at the 24 Hours of Le Mans in 1966.,James Mangold,Matt Damon,Christian Bale,Jon Bernthal,Caitriona Balfe
Forushande,2016,124,Drama,7.8,"While both participating in a production of ""Death of a Salesman,"" a teacher's wife is assaulted in her new home, which leaves him determined to find the perpetrator over his wife's traumatized objections.",Asghar Farhadi,Shahab Hosseini,Taraneh Alidoosti,Babak Karimi,Mina Sadati
Frost/Nixon,2008,122,"Biography, Drama, History",7.7,A dramatic retelling of the post-Watergate television interviews between British talk-show host David Frost and former president Richard Nixon.,Ron Howard,Frank Langella,Michael Sheen,Kevin Bacon,Sam Rockwell
Funny Games,1997,108,"Crime, Drama, Thriller",7.6,"Two violent young men take a mother, father, and son hostage in their vacation cabin and force them to play sadistic ""games"" with one another for their own amusement.",Michael Haneke,Susanne Lothar,Ulrich Mühe,Arno Frisch,Frank Giering
G.O.R.A.,2004,127,"Adventure, Comedy, Sci-Fi",8,A slick young Turk kidnapped by extraterrestrials shows his great « humanitarian spirit » by outwitting the evil commander-in-chief of the planet of G.O.R.A.,Ömer Faruk Sorak,Cem Yilmaz,Özge Özberk,Ozan Güven,Safak Sezer
Gake no ue no Ponyo,2008,101,"Animation, Adventure, Comedy",7.7,"A five-year-old boy develops a relationship with Ponyo, a young goldfish princess who longs to become a human after falling in love with him.",Hayao Miyazaki,Cate Blanchett,Matt Damon,Liam Neeson,Tomoko Yamaguchi
Gangs of Wasseypur,2012,321,"Action, Comedy, Crime",8.2,"A clash between Sultan and Shahid Khan leads to the expulsion of Khan from Wasseypur, and ignites a deadly blood feud spanning three generations.",Anurag Kashyap,Manoj Bajpayee,Richa Chadha,Nawazuddin Siddiqui,Tigmanshu Dhulia
Gattaca,1997,106,"Drama, Sci-Fi, Thriller",7.8,A genetically inferior man assumes the identity of a superior one in order to pursue his lifelong dream of space travel.,Andrew Niccol,Ethan Hawke,Uma Thurman,Jude Law,Gore Vidal
Gegen die Wand,2004,121,"Drama, Romance",7.9,"With the intention to break free from the strict familial restrictions, a suicidal young woman sets up a marriage of convenience with a forty-year-old addict, an act that will lead to an outburst of envious love.",Fatih Akin,Birol Ünel,Sibel Kekilli,Güven Kiraç,Zarah Jane McKenzie
Get Out,2017,104,"Horror, Mystery, Thriller",7.7,"A young African-American visits his white girlfriend's parents for the weekend, where his simmering uneasiness about their reception of him eventually reaches a boiling point.",Jordan Peele,Daniel Kaluuya,Allison Williams,Bradley Whitford,Catherine Keener
Gifted,2017,101,Drama,7.6,"Frank, a single man raising his child prodigy niece Mary, is drawn into a custody battle with his mother.",Marc Webb,Chris Evans,Mckenna Grace,Lindsay Duncan,Octavia Spencer
Gisaengchung,2019,132,"Comedy, Drama, Thriller",8.6,Greed and class discrimination threaten the newly formed symbiotic relationship between the wealthy Park family and the destitute Kim clan.,Bong Joon Ho,Kang-ho Song,Lee Sun-kyun,Cho Yeo-jeong,Choi Woo-sik
Gladiator,2000,155,"Action, Adventure, Drama",8.5,A former Roman General sets out to exact vengeance against the corrupt emperor who murdered his family and sent him into slavery.,Ridley Scott,Russell Crowe,Joaquin Phoenix,Connie Nielsen,Oliver Reed
God's Own Country,2017,104,"Drama, Romance",7.7,"Spring. Yorkshire. Young farmer Johnny Saxby numbs his daily frustrations with binge drinking and casual sex, until the arrival of a Romanian migrant worker for lambing season ignites an intense relationship that sets Johnny on a new path.",Francis Lee,Josh O'Connor,Alec Secareanu,Gemma Jones,Ian Hart
Gone Baby Gone,2007,114,"Crime, Drama, Mystery",7.6,"Two Boston area detectives investigate a little girl's kidnapping, which ultimately turns into a crisis both professionally and personally.",Ben Affleck,Morgan Freeman,Ed Harris,Casey Affleck,Michelle Monaghan
Gone Girl,2014,149,"Drama, Mystery, Thriller",8.1,"With his wife's disappearance having become the focus of an intense media circus, a man sees the spotlight turned on him when it's suspected that he may not be innocent.",David Fincher,Ben Affleck,Rosamund Pike,Neil Patrick Harris,Tyler Perry
Gongdong gyeongbi guyeok JSA,2000,110,"Action, Drama, Thriller",7.8,"After a shooting incident at the North/South Korean border/DMZ leaves 2 North Korean soldiers dead, a neutral Swiss/Swedish team investigates, what actually happened.",Chan-wook Park,Lee Yeong-ae,Lee Byung-Hun,Kang-ho Song,Kim Tae-Woo
Good Bye Lenin!,2003,121,"Comedy, Drama, Romance",7.7,"In 1990, to protect his fragile mother from a fatal shock after a long coma, a young man must keep her from learning that her beloved nation of East Germany as she knew it has disappeared.",Wolfgang Becker,Daniel Brühl,Katrin Saß,Chulpan Khamatova,Florian Lukas
Good Will Hunting,1997,126,"Drama, Romance",8.3,"Will Hunting, a janitor at M.I.T., has a gift for mathematics, but needs help from a psychologist to find direction in his life.",Gus Van Sant,Robin Williams,Matt Damon,Ben Affleck,Stellan Skarsgård
Gran Torino,2008,116,Drama,8.1,"Disgruntled Korean War veteran Walt Kowalski sets out to reform his neighbor, Thao Lor, a Hmong teenager who tried to steal Kowalski's prized possession: a 1972 Gran Torino.",Clint Eastwood,Clint Eastwood,Bee Vang,Christopher Carley,Ahney Her
Gravity,2013,91,"Drama, Sci-Fi, Thriller",7.7,Two astronauts work together to survive after an accident leaves them stranded in space.,Alfonso Cuarón,Sandra Bullock,George Clooney,Ed Harris,Orto Ignatiussen
Green Book,2018,130,"Biography, Comedy, Drama",8.2,A working-class Italian-American bouncer becomes the driver of an African-American classical pianist on a tour of venues through the 1960s American South.,Peter Farrelly,Viggo Mortensen,Mahershala Ali,Linda Cardellini,Sebastian Maniscalco
Guardians of the Galaxy,2014,121,"Action, Adventure, Comedy",8,A group of intergalactic criminals must pull together to stop a fanatical warrior with plans to purge the universe.,James Gunn,Chris Pratt,Vin Diesel,Bradley Cooper,Zoe Saldana
Guardians of the Galaxy Vol. 2,2017,136,"Action, Adventure, Comedy",7.6,"The Guardians struggle to keep together as a team while dealing with their personal family issues, notably Star-Lord's encounter with his father the ambitious celestial being Ego.",James Gunn,Chris Pratt,Zoe Saldana,Dave Bautista,Vin Diesel
Gully Boy,2019,154,"Drama, Music, Romance",8,A coming-of-age story based on the lives of street rappers in Mumbai.,Zoya Akhtar,Vijay Varma,Nakul Roshan Sahdev,Ranveer Singh,Vijay Raaz
Hævnen,2010,118,"Drama, Romance",7.6,"The lives of two Danish families cross each other, and an extraordinary but risky friendship comes into bud. But loneliness, frailty and sorrow lie in wait.",Susanne Bier,Mikael Persbrandt,Trine Dyrholm,Markus Rygaard,Wil Johnson
Hable con ella,2002,112,"Drama, Mystery, Romance",7.9,Two men share an odd friendship while they care for two women who are both in deep comas.,Pedro Almodóvar,Rosario Flores,Javier Cámara,Darío Grandinetti,Leonor Watling
Hachi: A Dog's Tale,2009,93,"Biography, Drama, Family",8.1,A college professor bonds with an abandoned dog he takes into his home.,Lasse Hallström,Richard Gere,Joan Allen,Cary-Hiroyuki Tagawa,Sarah Roemer
Hacksaw Ridge,2016,139,"Biography, Drama, History",8.1,"World War II American Army Medic Desmond T. Doss, who served during the Battle of Okinawa, refuses to kill people, and becomes the first man in American history to receive the Medal of Honor without firing a shot.",Mel Gibson,Andrew Garfield,Sam Worthington,Luke Bracey,Teresa Palmer
Haider,2014,160,"Action, Crime, Drama",8.1,"A young man returns to Kashmir after his father's disappearance to confront his uncle, whom he suspects of playing a role in his father's fate.",Vishal Bhardwaj,Shahid Kapoor,Tabu,Shraddha Kapoor,Kay Kay Menon
Hamilton,2020,160,"Biography, Drama, History",8.6,"The real life of one of America's foremost founding fathers and first Secretary of the Treasury, Alexander Hamilton. Captured live on Broadway from the Richard Rodgers Theater with the original Broadway cast.",Thomas Kail,Lin-Manuel Miranda,Phillipa Soo,Leslie Odom Jr.,Renée Elise Goldsberry
Hana-bi,1997,103,"Crime, Drama, Romance",7.8,"Nishi leaves the police in the face of harrowing personal and professional difficulties. Spiraling into depression, he makes questionable decisions.",Takeshi Kitano,Takeshi Kitano,Kayoko Kishimoto,Ren Osugi,Susumu Terajima
Happiness,1998,134,"Comedy, Drama",7.7,"The lives of several individuals intertwine as they go about their lives in their own unique ways, engaging in acts society as a whole might find disturbing in a desperate search for human connection.",Todd Solondz,Jane Adams,Jon Lovitz,Philip Seymour Hoffman,Dylan Baker
